cas_latency,category,color,ecc,form_factor,lighting,manufacturer,manufacturer_color,modules_capacity_gb,modules_quantity,name,opendb_id,part_id,ram_type,registered,release_year,rgb,series,speed,total_capacity_gb,variant,voltage
,ram,,,,,Kingston,,,,Kingston FURY Renegade White / Silver DDR5-6400 CL32 16GB (1x16GB),801a88ad-a9d8-49e6-906d-e47ee4c6a876,ram_2199,,,,,FURY,,,6400 CL32,
,ram,,,,,Kingston,,,,Kingston FURY Beast Black DDR5-5200 CL40 64GB (2x32GB),8035fe0e-4132-48bd-941b-019cd58120a1,ram_2200,,,,,FURY,,,5200 CL40,
,ram,,,,,TEAMGROUP,,,,TEAMGROUP Xtreem ARGB Black DDR5-8200 CL38 48GB (2x24GB),803d9b73-58ca-47d9-9ef9-8d56fb3af3a4,ram_2201,,,,,Xtreem,,,8200 CL38,
,ram,,,,,ADATA,,,,ADATA XPG V1.0 Black DDR3-1600 CL9 16GB (2x8GB),8043ddb5-8805-4c31-82b5-8b454a6fb81e,ram_2202,,,,,XPG,,,1600 CL9,
,ram,,,,,Corsair,,,,Corsair Vengeance LPX DDR4-3200 CL16 32GB (2x16GB),8069cf8c-4604-4cb2-94f3-0123957e9699,ram_2203,,,,,Vengeance,,,3200 CL16,
,ram,,,,,Kingston,,,,Kingston HyperX Fury Black / Silver DDR3-1600 CL10 8GB (2x4GB),8072dbb8-bf19-413f-8d98-b205328d237a,ram_2204,,,,,HyperX,,,1600 CL10,
,ram,,,,,Corsair,,,,Corsair Vengeance RGB Black / Gray DDR5-6400 CL36 32GB (2x16GB),80af78c9-f1d2-468f-8993-a05f63aa2272,ram_2205,,,,,Vengeance,,,6400 CL36,
,ram,,,,,G.SKILL,,,,G.Skill Trident Z Neo Black / White (For AMD Ryzen) DDR4-2666 CL18 32GB (2x16GB),80b78280-ce9d-4211-a349-db7aa19b0775,ram_2206,,,,,Trident,,,2666 CL18,
,ram,,,,,Mushkin,,,,Mushkin Redline Black DDR5-4800 CL40 96GB (2x48GB),80c79808-aa3b-40c2-b485-b63e4dbad2bd,ram_2207,,,,,Redline,,,4800 CL40,
,ram,,,,,Corsair,,,,Corsair Vengeance LPX Black / Yellow DDR4-3000 CL16 32GB (1x32GB),80d24cd5-befb-4ef1-8043-439b5ae2a797,ram_2208,,,,,Vengeance,,,3000 CL16,
,ram,,,,,Corsair,,,,Corsair Vengeance LPX Black / Yellow DDR4-3600 CL18 8GB (2x4GB),80f4a791-3d4d-431b-806b-ea44cc3738f5,ram_2209,,,,,Vengeance,,,3600 CL18,
,ram,,,,,Corsair,,,,Corsair Vengeance RGB Pro White DDR4-3466 CL16 32GB (2x16GB),80fb7475-fe33-4362-b985-496371f56cc0,ram_2210,,,,,Vengeance,,,3466 CL16,
,ram,,,,,Timetec,,,,Timetec PINNACLE Konduit Black DDR4-3600 CL18 16GB (1x16GB),8100401b-23da-4b58-a429-38fa5bcb935b,ram_2211,,,,,PINNACLE,,,3600 CL18,
,ram,,,,,TEAMGROUP,,,,TEAMGROUP T-Force Delta RGB Black DDR4 64GB(2x32GB) 2666MHz CL18,810ad3ba-8434-424f-a604-42eb9cee5058,ram_2212,,,,,T-Force,,,Delta RGB BLACK DDR4,
,ram,,,,,PNY,,,,PNY MD32768K4D3-1866-X9 Black / Silver DDR3-1866 CL9 32GB (4x8GB),810c7f2b-a943-42c2-b841-8feb778de485,ram_2213,,,,,MD32768K4D3-1866-X9,,,1866 CL9,
,ram,,,,,OLOy,,,,OLOy Blade RGB Black DDR5-6000 CL36 32GB (2x16GB),810eb6b4-803c-44db-b06d-7fac65c92431,ram_2214,,,,,Blade,,,6000 CL36,
,ram,,,,,Kingston,,,,Kingston FURY Renegade White / Silver DDR5-6000 CL32 16GB (1x16GB),810feb18-0fb6-4cb0-b153-fc590b930086,ram_2215,,,,,FURY,,,6000 CL32,
,ram,,,,,Mushkin,,,,Mushkin Redline White DDR4-3200 CL16 32GB (2x16GB),81217fe1-ebcb-4a3e-acd1-15cac1953113,ram_2216,,,,,Redline,,,3200 CL16,
,ram,,,,,Kingston,,,,Kingston FURY Beast RGB White DDR5-6000 CL30 64GB (2x32GB),812e59ad-826f-4b9d-b844-d574ff303f8e,ram_2217,,,,,FURY,,,6000 CL30,
,ram,,,,,Corsair,,,,Corsair Vengeance LPX Black / Yellow DDR4-4000 CL18 32GB (2x16GB),81301a53-cd17-4424-bd76-fb80e2b985c1,ram_2218,,,,,Vengeance,,,4000 CL18,
,ram,,,,,Corsair,,,,Corsair Vengeance RGB Pro SL Black DDR4-3200 CL16 256GB (8x32GB),8139ae99-6ef0-46a8-945a-976c8d60a378,ram_2219,,,,,Vengeance,,,3200 CL16,
,ram,,,,,Kingston,,,,Kingston Fury Renegade RGB Silver / Black DDR5-6800 CL36 16GB (1x16GB),813a0842-b42a-4ad2-92b2-562e2c37cdb6,ram_2220,,,,,Fury,,,6800 CL36,
,ram,,,,,TEAMGROUP,,,,TEAMGROUP T-Create Expert White DDR5-6400 CL32 48GB (2x24GB),81521102-4156-471a-b65a-e37cb34f4b6e,ram_2221,,,,,T-Create,,,6400 CL32,
,ram,,,,,Silicon Power,,,,Silicon Power DDR5 32GB (2x16GB) Zenith RGB 6000MHz CL38 WHITE,815cdfd7-2cf3-4cb7-bb3b-ff4c2220f3fb,ram_2222,,,,,XPOWER Zenith RGB,,,6000 CL38,
,ram,,,,,Kingston,,,,Kingston HyperX Fury Black / White DDR4-2133 CL14 8GB (2x4GB),815f4b52-05b1-40cf-a8b3-266317805652,ram_2223,,,,,HyperX,,,2133 CL14,
,ram,,,,,G.SKILL,,,,G.Skill Aegis Black / Red DDR4-2400 CL15 64GB (4x16GB),81690b27-1a05-49b7-8bd4-24aefbb59f60,ram_2224,,,,,Aegis,,,2400 CL15,
,ram,,,,,Kingston,,,,Kingston FURY Beast Black DDR4-3600 CL18 16GB (1x16GB),81793251-0d7e-48c2-a0f5-38e1bdd191e1,ram_2225,,,,,FURY,,,3600 CL18,
,ram,,,,,TEAMGROUP,,,,TEAMGROUP T-Force Delta RGB DDR4 32GB (1x32GB) 3200MHz CL16 WHITE,81821621-b9c8-43d0-8d55-897f505ddcfc,ram_2226,,,,,T-Force,,,Delta RGB White DDR4,
,ram,,,,,Samsung,,,,Samsung M393A2G40DB0-CPB Registered Black / Green DDR4-2133 CL15 16GB (1x16GB),819846c8-304f-4198-b9c9-d4f61dc87bd1,ram_2227,,,,,M393A2G40DB0-CPB,,,2133 CL15,
,ram,,,,,TEAMGROUP,,,,TEAMGROUP T-Create Expert Black / Gold DDR5-6400 CL32 96GB (2x48GB),81a7e456-3211-41c8-a429-998f480b3daf,ram_2228,,,,,T-Create,,,6400 CL32,
,ram,,,,,Acer,,,,Acer Predator Hera RGB DDR5-7200 CL34 32GB (2x16GB),81b17958-4f3d-4666-9f37-d5f9dae343a5,ram_2229,,,,,Predator,,,7200 CL34,
,ram,,,,,Corsair,,,,Corsair Vengeance LPX Black / Yellow DDR4-2666 CL16 16GB (1x16GB),81b73b13-d475-4618-9e66-190905e4ea66,ram_2230,,,,,Vengeance,,,2666 CL16,
,ram,,,,,Kingston,,,,Kingston FURY Renegade Pro Black Registered DDR5-5600 CL36 128GB (8x16GB),81c5d6da-d97a-416a-85c8-13f04b59ef87,ram_2231,,,,,FURY,,,5600 CL36,
,ram,,,,,v-color,,,,V-Color TRA524G56S836Q White Registered DDR5-5600 CL36 96GB (4x24GB),81df685f-dc3b-4d01-8814-114fe40ee78a,ram_2232,,,,,TRA524G56S836Q,,,5600 CL36,
,ram,,,,,Kingston,,,,Kingston HyperX Fury Blue / Silver DDR3-1600 CL10 16GB (2x8GB),81e2aba7-ddbe-4a73-82e7-b65fbb21ea1d,ram_2233,,,,,HyperX,,,1600 CL10,
,ram,,,,,ADATA,,,,ADATA XPG SPECTRIX D41 Black / White DDR4-3000 CL16 8GB (1x8GB),820b1801-d13c-4a61-84fb-00ac153598eb,ram_2234,,,,,XPG,,,3000 CL16,
,ram,,,,,G.SKILL,,,,G.Skill Flare X5 Black / White DDR5-5200 CL36 32GB (2x16GB),820bfcda-4a86-4d5d-bc64-3b291489c1e6,ram_2235,,,,,Flare,,,5200 CL36,
,ram,,,,,Kingston,,,,Kingston Fury Renegade RGB Silver / Black DDR5-6400 CL32 48GB (1x48GB),82255db6-fac2-4fe0-92c5-e66e5afef0b7,ram_2236,,,,,Fury,,,6400 CL32,
,ram,,,,,Silicon Power,,,,Silicon Power XPOWER Pulse Gaming Black / White DDR5-5600 CL40 64GB (2x32GB),8227c61d-f448-46a2-85f7-2f1dc7b2e2e8,ram_2237,,,,,XPOWER,,,5600 CL40,
,ram,,,,,G.SKILL,,,,G.Skill Ripjaws 4 Red DDR4-2400 CL15 8GB (2x4GB),823d63e5-c4e1-472a-ab00-af90f0a80119,ram_2238,,,,,Ripjaws,,,2400 CL15,
,ram,,,,,Patriot,,,,Patriot Signature Line Black DDR4-2666 CL19 32GB (1x32GB),825dd2b5-0d98-42ce-841d-38c6f07180a9,ram_2239,,,,,Signature,,,2666 CL19,
,ram,,,,,Corsair,,,,Corsair Dominator Black DDR5-6000 CL30 64GB (2x32GB),82983606-4804-48a3-b380-140cf6c3fbc4,ram_2240,,,,,Dominator,,,6000 CL30,
,ram,,,,,Kingston,,,,Kingston KSM29RD4/64HAR Registered DDR4-2933 CL21 64GB (1x64GB),82ab9a33-fce4-41ae-b118-b1ca1abe3484,ram_2241,,,,,KSM29RD4/64HAR,,,2933 CL21,
,ram,,,,,Corsair,,,,Corsair Vengeance RGB Black DDR5-6000 CL40 32GB (2x16GB),82bd7e95-8d7a-4bac-9523-eab2f49a7328,ram_2242,,,,,Vengeance,,,6000 CL40,
,ram,,,,,OLOy,,,,OLOy Blade Black DDR4-3200 CL16 16GB (2x8GB),82c05f46-a0ce-451b-995b-5a0b899905ca,ram_2243,,,,,Blade,,,3200 CL16,
,ram,,,,,Apacer,,,,Apacer AU Black DDR4-3200 CL22 16GB (1x16GB),82c8da07-dae5-4d62-9b27-d8172471ee33,ram_2244,,,,,AU,,,3200 CL22,
,ram,,,,,GeIL,,,,GeIL ORION V RGB Red DDR5-8000 CL38 32GB (2x16GB),82cb43f5-2f22-4ddc-85fd-13fd7b862f54,ram_2245,,,,,ORION,,,8000 CL38,
,ram,,,,,G.SKILL,,,,G.Skill Sniper X Black / White DDR4-3200 CL16 16GB (2x8GB),82d47188-4893-414e-a54a-f43c0fdfab41,ram_2246,,,,,Sniper,,,3200 CL16,
,ram,,,,,Corsair,,,,Corsair Vengeance LPX Black / Yellow DDR4-2400 CL16 8GB (2x4GB),82e6cfc5-04b8-4767-b85a-91921113f15d,ram_2247,,,,,Vengeance,,,2400 CL16,
,ram,,,,,Silicon Power,,,,Silicon Power DDR5 64GB (2x32GB) Zenith 6000MHz CL30 WHITE,82f596bf-b15d-4860-a965-dc5c2fa8fbfd,ram_2248,,,,,XPOWER Zenith,,,6000 CL30,
,ram,,,,,TEAMGROUP,,,,TEAMGROUP T-Force Delta RGB DDR4 32GB (1x32GB) 3600MHz CL18 WHITE,830955d4-87ac-454b-8a98-0892e667fbd8,ram_2249,,,,,T-Force,,,Delta RGB White DDR4,
,ram,,,,,Corsair,,,,Corsair Vengeance Black DDR5-5600 CL40 32GB (1x32GB),830a9f67-282d-4972-8663-5bedb93d6ec5,ram_2250,,,,,Vengeance,,,5600 CL40,
,ram,,,,,ADATA,,,,ADATA XPG LANCER RGB White 64GB (2x32GB) DDR5 6000 CL30,8324dd5f-090f-47b1-ba92-73c1a5f437fd,ram_2251,,,,,XPG Lancer,,,6000 CL30,
,ram,,,,,Corsair,,,,Corsair Vengeance RGB Pro Black DDR4-3600 CL18 64GB (4x16GB),832f9bf6-2884-433d-b14e-be8f244a107e,ram_2252,,,,,Vengeance,,,3600 CL18,
,ram,,,,,Corsair,,,,Corsair Vengeance LPX Black / Yellow DDR4-4800 CL18 16GB (2x8GB),8335816f-e734-4ccc-9925-a1d10f2b24a4,ram_2253,,,,,Vengeance,,,4800 CL18,
,ram,,,,,G.SKILL,,,,G.Skill Ripjaws V DDR4-3600 CL19 16GB (2x8GB),83642fe7-ff9d-4df5-aaa8-29711a65d2b2,ram_2254,,,,,Ripjaws,,,3600 CL19,
,ram,,,,,Kingston,,,,Kingston ValueRAM DDR2-667 CL5 2GB (1x2GB),8380723a-a5f5-4642-a8a7-292b7cb6ee49,ram_2255,,,,,ValueRAM,,,667 CL5,
,ram,,,,,Kingston,,,,Kingston FURY Beast White DDR5-6000 CL30 16GB (1x16GB),839f12be-b945-4d9d-8e61-e213e3d4b702,ram_2256,,,,,FURY,,,6000 CL30,
,ram,,,,,PNY,,,,PNY Anarchy X Black / Red DDR4-2666 CL15 16GB (4x4GB),83b3bebd-bc60-4b97-a122-1f3cf94bfec4,ram_2257,,,,,Anarchy,,,2666 CL15,
,ram,,,,,Corsair,,,,Corsair Vengeance RGB Pro Black DDR4-3200 CL16 32GB (4x8GB),83c4af42-6d4d-4641-866d-f31fab361f07,ram_2258,,,,,Vengeance,,,3200 CL16,
,ram,,,,,TEAMGROUP,,,,TEAMGROUP T-Force Delta RGB White DDR5-6000 CL30 16GB (1x16GB),83c93682-71c5-44de-94c4-2a16a2934bc7,ram_2259,,,,,T-Force,,,6000 CL30,
,ram,,,,,G.SKILL,,,,G.Skill Ripjaws V Black DDR4-3600 CL14 64GB (4x16GB),83cc8cd8-a0b0-43c7-a9cc-f3a75ec113e7,ram_2260,,,,,Ripjaws,,,3600 CL14,
,ram,,,,,G.SKILL,,,,G.Skill Trident Z RGB Black DDR4-3600 CL16 64GB (4x16GB),83da69bb-b5a7-4f1c-9854-c6b7a21e44ec,ram_2261,,,,,Trident,,,3600 CL16,
,ram,,,,,Gigastone,,,,GIGASTONE Game PRO 32GB Kit (4x8GB) DDR4 3200MHz CL16 RED,83f443e2-572b-418f-9511-a4835b031780,ram_2262,,,,,Game PRO,,,3200 CL16,
,ram,,,,,Silicon Power,,,,Silicon Power SP024GBLVU560P02 Black DDR5-5600 CL46 24GB (1x24GB),840f1e7a-b5ac-43c8-b1f1-f2ba0162b3bc,ram_2263,,,,,SP024GBLVU560P02,,,5600 CL46,
,ram,,,,,G.SKILL,,,,G.Skill Trident Z5 Neo RGB 32GB (2x16GB) DDR5 6000 CL30 White,842444ab-12cc-48b9-9820-75445feaf5f6,ram_2264,,,2025,,Trident,,,6000 CL30,
,ram,,,,,Corsair,,,,Corsair Vengeance White / Gray DDR5-5200 CL38 32GB (2x16GB),8436612a-440a-436c-bc44-cea4addde2de,ram_2265,,,,,Vengeance,,,5200 CL38,
,ram,,,,,Kingston,,,,Kingston FURY Beast Black DDR5-6000 CL30 32GB (2x16GB),84427fd2-d30e-4ade-8bd2-d5b1094bf09e,ram_2266,,,,,FURY,,,6000 CL30,
,ram,,,,,PNY,,,,PNY Performance Black DDR5-4800 CL40 16GB (1x16GB),844e4c5f-d1c2-40ea-b932-2ac36ae0124c,ram_2267,,,,,Performance,,,4800 CL40,
,ram,,,,,Kingston,,,,Kingston FURY Renegade Pro Registered Black DDR5-5600 CL36 32GB (1x32GB),844f8ca3-f877-4cb5-b023-18e9db4cd156,ram_2268,,,,,FURY,,,5600 CL36,
,ram,,,,,Kingston,,,,Kingston ValueRAM SODIMM DDR5-4800 CL40 64GB (2x32GB),846b32a3-a1f2-4c83-a6f3-258662245175,ram_2269,,,,,ValueRAM,,,4800 CL40,
,ram,,,,,TEAMGROUP,,,,TEAMGROUP T-Create Expert White DDR5-6000 CL38 32GB (2x16GB),8494f1b7-c452-4f16-8ebd-97a4b670d467,ram_2270,,,,,T-Create,,,6000 CL38,
,ram,,,,,G.SKILL,,,,G.Skill Trident Z5 RGB Black DDR5-8000 CL38 32GB (2x16GB),84d43907-7d77-4814-bae1-c896aa97e85c,ram_2271,,,,,Trident,,,8000 CL38,
,ram,,,,,Corsair,,,,Corsair Dominator Platinum RGB Black DDR4-3600 CL18 32GB (4x8GB),850b6eff-262c-4f87-8c19-740418293185,ram_2272,,,,,Dominator,,,3600 CL18,
,ram,,,,,Corsair,,,,Corsair Vengeance White DDR5-5600 CL36 32GB (2x16GB),85104f69-1a19-4543-b86a-5dfc2b08870f,ram_2273,,,,,Vengeance,,,5600 CL36,
,ram,,,,,G.SKILL,,,,G.Skill Trident Z5 RGB Black DDR5-8000 CL38 48GB (2x24GB),8515c948-4d4d-4d62-9b02-8517f68524e6,ram_2274,,,,,Trident,,,8000 CL38,
,ram,,,,,Kingston,,,,Kingston FURY Beast RGB 8GB (1x8GB) DDR5 5200 CL40 Black,852ac053-f6e9-4438-a345-c3b927a9a4a5,ram_2275,,,2022,,FURY Beast RGB,,,5200 CL40,
,ram,,,,,TEAMGROUP,,,,TEAMGROUP T-Force Delta RGB White DDR5-6400 CL40 32GB (2x16GB),8565ee02-599b-41ae-b918-64be15f5ad2c,ram_2276,,,,,T-Force,,,6400 CL40,
,ram,,,,,GeIL,,,,GeIL ORION V Red DDR5-8000 CL38 32GB (2x16GB),8565f910-33d6-407b-8ce0-067c8951802d,ram_2277,,,,,ORION,,,8000 CL38,
,ram,,,,,Acer,,,,Acer Predator Hermes RGB Black DDR5-8000 CL36 32GB (2x16GB),856d36a7-ce14-4ee8-82ad-4a27b0d9a91a,ram_2278,,,,,Predator,,,8000 CL36,
,ram,,,,,G.SKILL,,,,G.Skill Trident Z Royal Silver DDR4-4000 CL18 32GB (2x16GB),857a1818-22e3-4940-80ad-05cdda050820,ram_2279,,,,,Trident,,,4000 CL18,
,ram,,,,,Kingston,,,,Kingston FURY Beast RGB Black DDR5-5600 CL40 8GB (1x8GB),857be2b3-6aef-4c80-a884-806a087420b2,ram_2280,,,,,FURY,,,5600 CL40,
,ram,,,,,Corsair,,,,Corsair Vengeance RGB White DDR5-5200 CL40 32GB (2x16GB),858064f6-b43d-428d-8d02-b85d2d833cfc,ram_2281,,,,,Vengeance,,,5200 CL40,
,ram,,,,,Corsair,,,,Corsair Dominator Platinum RGB Black DDR5-4800 CL40 32GB (2x16GB),8582069f-b1d5-4f27-aa8e-f0e50bc032eb,ram_2282,,,,,Dominator,,,4800 CL40,
,ram,,,,,ADATA,,,,ADATA XPG GAMMIX D10 Red / White DDR4-2400 CL16 8GB (1x8GB),8589b5b4-2f17-4de3-a5e0-42803dab4e23,ram_2283,,,,,XPG,,,2400 CL16,
,ram,,,,,Corsair,,,,Corsair Vengeance RGB RT Black DDR4-3600 CL16 16GB (2x8GB),859c64d2-a2df-45bd-a996-df04fb6176b1,ram_2284,,,,,Vengeance,,,3600 CL16,
,ram,,,,,ADATA,,,,ADATA XPG GAMMIX D30 Silver / Red DDR4-3000 CL16 16GB (2x8GB),85a55c63-6615-48a0-ac0f-4efb2c11ddbe,ram_2285,,,,,XPG,,,3000 CL16,
,ram,,,,,Corsair,,,,Corsair Vengeance RGB Black DDR5-6400 CL32 32GB (2x16GB),85ae826d-196f-4234-b947-2587c447674d,ram_2286,,,,,Vengeance,,,6400 CL32,
,ram,,,,,Silicon Power,,,,Silicon Power XPOWER Zenith RGB Gaming WHITE DDR5-6000 CL30 16GB (1x16GB),85af438d-314d-4be1-a30d-3579bdee8179,ram_2287,,,,,XPOWER Zenith RGB,,,6000 CL30,
,ram,,,,,Silicon Power,,,,Silicon Power DDR5 16GB (2x8GB) Zenith 6000MHz CL36 BLACK,85d244cb-8209-4373-8d7f-c4e748b6b7df,ram_2288,,,,,XPOWER Zenith,,,6000 CL36,
,ram,,,,,TEAMGROUP,,,,TEAMGROUP T-Force Delta RGB DDR5-5600 CL32 32GB (2x16GB),85d685f6-f1c2-4d6a-be48-ee2dc81daf97,ram_2289,,,,,T-Force,,,5600 CL32,
,ram,,,,,G.SKILL,,,,G.Skill Trident Z5 Silver DDR5-7600 CL36 32GB (2x16GB),85f94227-e2e3-4323-b5dc-3e64796f9118,ram_2290,,,,,Trident,,,7600 CL36,
,ram,,,,,v-color,,,,V-Color TRA548G64D832Q Registered White DDR5-6400 CL32 192GB (4x48GB),85fd6cff-7182-4b24-9778-8aa5575ef30f,ram_2291,,,,,TRA548G64D832Q,,,6400 CL32,
,ram,,,,,TEAMGROUP,,,,TEAMGROUP Elite Black DDR4-3200 CL22 32GB (2x16GB),85ff0d25-ad45-45d1-8989-47c56618a1dc,ram_2292,,,,,Elite,,,3200 CL22,
,ram,,,,,TEAMGROUP,,,,TEAMGROUP Xtreem Black DDR5-8000 CL38 48GB (2x24GB),8601db99-cdbb-4554-a0ec-6bb5f3bb1c30,ram_2293,,,,,Xtreem,,,8000 CL38,
,ram,,,,,Silicon Power,,,,Silicon Power DDR5 16GB (2x8GB) Zenith 6000MHz CL36 WHITE,8603f4e2-3196-4f61-9a69-6841105c738c,ram_2294,,,,,XPOWER Zenith,,,6000 CL36,
,ram,,,,,Kingston,,,,Kingston FURY White DDR5-5600 CL40 64GB (2x32GB),860f36ea-a3d1-401c-b75b-d30b5073b2cf,ram_2295,,,,,FURY,,,5600 CL40,
,ram,,,,,Kingston,,,,Kingston KVR1333D3/2GR Green DDR3-1333 CL9 2GB (1x2GB),86128095-823f-4eb4-a207-68e5e5e330d2,ram_2296,,,,,KVR1333D3/2GR,,,1333 CL9,
,ram,,,,,TEAMGROUP,,,,TEAMGROUP T-Force Delta RGB White DDR5-8000 CL38 32GB (2x16GB),8617afd4-fb9f-4c09-972e-7286f9632e51,ram_2297,,,,,T-Force,,,8000 CL38,
,ram,,,,,TEAMGROUP,,,,TEAMGROUP T-Force Vulcan Black DDR5-6000 CL38 64GB (2x32GB),8626e5b1-979a-470f-a01c-45d7ef5ebdc0,ram_2298,,,,,T-Force,,,6000 CL38,
,ram,,,,,ADATA,,,,ADATA XPG Lancer Blade Black DDR5-5600 CL46 32GB (2x16GB),86378c1a-00de-4d48-bd37-3d309120ea46,ram_2299,,,,,XPG,,,5600 CL46,
,ram,,,,,Acer,,,,Acer Predator Hermes RGB Silver DDR5-7200 CL34 32GB (2x16GB),863b1e02-1cec-48ce-b5f7-8dd9b8700dbf,ram_2300,,,,,Predator,,,7200 CL34,
,ram,,,,,TEAMGROUP,,,,TEAMGROUP T-Force Delta RGB Black DDR5-5600 CL38 64GB (2x32GB),864204f2-1097-4bbc-84ff-f845b2ecfd40,ram_2301,,,,,T-Force,,,5600 CL38,
,ram,,,,,Patriot,,,,Patriot Viper Silver / Black DDR4-3200 CL16 8GB (2x4GB),865b0f17-8a7d-430f-8e0a-eb04093d349c,ram_2302,,,,,Viper,,,3200 CL16,
,ram,,,,,Thermaltake,,,,Thermaltake TOUGHRAM RGB White / Silver DDR4-3200 CL16 16GB (2x8GB),86723994-ad1f-46d6-83ac-b33c8ebbb311,ram_2303,,,,,TOUGHRAM,,,3200 CL16,
,ram,,,,,GOODRAM,,,,GOODRAM IRDM Black DDR5-6000 CL30 64GB (2x32GB),867a2084-db2c-4fbc-b782-a409c9e31f2a,ram_2304,,,,,IRDM,,,6000 CL30,
,ram,,,,,Corsair,,,,Corsair Vengeance LPX Red DDR4-3000 CL15 16GB (2x8GB),867ad5f3-6d5e-4f93-8842-21da94435eef,ram_2305,,,,,Vengeance,,,3000 CL15,
,ram,,,,,Silicon Power,,,,Silicon Power GAMING Black DDR4-3200 CL16 32GB (2x16GB),867f8520-5a7b-455c-909b-ef6c149d6df1,ram_2306,,,,,GAMING,,,3200 CL16,
,ram,,,,,G.SKILL,,,,G.Skill Trident Z5 Neo RGB Black DDR5-6000 CL28 48GB (2x24GB),869814eb-58e2-4957-992e-d46c57114a4f,ram_2307,,,,,Trident,,,6000 CL28,
,ram,,,,,TEAMGROUP,,,,TEAMGROUP Elite Black DDR5-4800 CL40 64GB (2x32GB),869bbbd7-2f90-4a4f-a20f-5d050f0ac8ad,ram_2308,,,,,Elite,,,4800 CL40,
,ram,,,,,Crucial,,,,Crucial CT2KIT25664AA667 Green DDR2-667 CL5 4GB (2x2GB),86a3bba3-1c76-497e-8f5b-7bba76ffefaa,ram_2309,,,,,CT2KIT25664AA667,,,667 CL5,
,ram,,,,,Crucial,,,,Crucial Ballistix 3200 MHz DDR4 DRAM Desktop Gaming Memory Kit 16GB (8GBx2) CL16 BL2K8G32C16U4B (Black),86b233fa-a663-484d-bee0-4cb7ea3fd532,ram_2310,,,2020,,Ballistix Sport,,,3200 MHz,
,ram,,,,,Corsair,,,,Corsair Vengeance RGB Black DDR5-6600 CL38 32GB (2x16GB),86b2b463-d284-4894-8ad5-53ae24980fbe,ram_2311,,,,,Vengeance,,,6600 CL38,
,ram,,,,,OLOy,,,,OLOy  Black DDR4-2666 CL16 16GB (2x8GB) MD4U082616BJDA,86c2cb7f-cc15-48a2-89ce-40f3176f6638,ram_2312,,,2020,,MD4U082616BJDA,,,2666 CL16,
,ram,,,,,G.SKILL,,,,G.Skill Trident Z Royal Elite Gold DDR4-4266 CL19 64GB (4x16GB),86cff8be-b70c-4178-ad6d-6a96c894a86f,ram_2313,,,,,Trident,,,4266 CL19,
,ram,,,,,Acer,,,,Acer Predator Vesta II RGB Silver DDR5-6000 CL30 32GB (2x16GB),86d2d219-1d4a-4c99-91ff-7ea575201c07,ram_2314,,,,,Predator,,,6000 CL30,
,ram,,,,,Kingston,,,,Kingston FURY Beast RGB White DDR5-6000 CL30 16GB (1x16GB),86ed249d-baac-4eda-b7e7-94e5fecd0960,ram_2315,,,,,FURY,,,6000 CL30,
,ram,,,,,Corsair,,,,Corsair Vengeance White DDR5-5200 CL40 64GB (2x32GB),86ff1bd3-2a85-426f-9508-175e1ca87151,ram_2316,,,,,Vengeance,,,5200 CL40,
,ram,,,,,Crucial,,,,Crucial CT2K16G3ERSLD4160B Green Registered DDR3-1600 CL11 32GB (2x16GB),8705f8f0-18de-414e-87e9-29d6924ba206,ram_2317,,,,,CT2K16G3ERSLD4160B,,,1600 CL11,
,ram,,,,,Kingston,,,,Kingston FURY Renegade Pro Registered Black Registered DDR5-6000 CL32 64GB (4x16GB),870aede5-4afa-4d55-bf6a-ad60c09ff98f,ram_2318,,,,,FURY,,,6000 CL32,
,ram,,,,,G.SKILL,,,,G.Skill Ripjaws M5 Neo RGB White DDR5-6000 CL36 64GB (2x32GB),8721b673-f40f-41c8-b013-71519bbf4db4,ram_2319,,,,,Ripjaws,,,6000 CL36,
,ram,,,,,ADATA,,,,ADATA XPG CASTER RGB Black / Silver DDR5-6400 CL32 32GB (2x16GB),872e9422-df3d-4820-9b8a-338a16d4bc05,ram_2320,,,,,XPG,,,6400 CL32,
,ram,,,,,G.SKILL,,,,G.Skill Trident Z Royal Gold DDR4-3200 CL16 16GB (2x8GB),87300c50-45b7-4004-b01e-4d5c261463e1,ram_2321,,,,,Trident,,,3200 CL16,
,ram,,,,,Kingston,,,,Kingston ValueRAM Green DDR2-667 CL5 1GB (1x1GB),8731d73f-da82-4df5-b49b-e68234181c98,ram_2322,,,,,ValueRAM,,,667 CL5,
,ram,,,,,Acer,,,,Acer Predator Pallas II Silver DDR5-6600 CL34 32GB (2x16GB),87371336-eec0-4689-976a-d3d95cce7514,ram_2323,,,,,Predator,,,6600 CL34,
,ram,,,,,G.SKILL,,,,G.Skill Ripjaws Black DDR4-3200 CL14 16GB (2x8GB),873926b7-8c98-4c5c-a636-423132050f6f,ram_2324,,,,,Ripjaws,,,3200 CL14,
,ram,,,,,Kingston,,,,Kingston HyperX Fury Black DDR4-2400 CL15 8GB (1x8GB),873f9c16-699d-4b36-baea-3db4527975d1,ram_2325,,,,,HyperX,,,2400 CL15,
,ram,,,,,G.SKILL,,,,G.Skill Trident Z5 Royal Neo RGB 96GB (2x48GB) DDR5 6000 CL28 White,874a9367-98f1-458f-b4ab-f7b733fc1e76,ram_2326,,,2025,,Trident,,,6000 CL28,
,ram,,,,,ADATA,,,,ADATA XPG Lancer Blade RGB Black DDR5-6400 CL32 32GB (2x16GB),874da619-0bc5-4987-bf01-f7f831c94a90,ram_2327,,,,,XPG,,,6400 CL32,
,ram,,,,,Corsair,,,,Corsair Vengeance LPX Black DDR4-3000 CL16 16GB (2x8GB),875416d9-eb75-41e2-9fb2-a5346e9a8e3a,ram_2328,,,,,Vengeance,,,3000 CL16,
,ram,,,,,G.SKILL,,,,G.SKILL Ripjaws S5 Series 32GB (2 x 16GB) DDR5 5600 Desktop Memory Model F5-5600U3636C16GX2-RS5W - White,87584c00-d619-4003-a1c6-02e0e3a04cdc,ram_2329,,,2021,,Ripjaws S5 Series,,,5600,
,ram,,,,,G.SKILL,,,,G.Skill Trident Z Royal Elite Silver DDR4-5333 CL22 16GB (2x8GB),876f8a45-5549-476e-8c8b-5e80f0afde84,ram_2330,,,,,Trident,,,5333 CL22,
,ram,,,,,Samsung,,,,Samsung SAMSUNG Green / Black DDR4-2933 CL21 64GB (1x64GB),877e48fc-8cc5-4227-b405-f9d5de1d831e,ram_2331,,,,,SAMSUNG,,,2933 CL21,
,ram,,,,,TEAMGROUP,,,,TEAMGROUP T-Force Vulcan Z Gray / Black DDR4-3600 CL18 16GB (1x16GB),87969f79-ab81-4a58-b9f1-e26818ed059a,ram_2332,,,,,T-Force,,,3600 CL18,
,ram,,,,,Kingston,,,,Kingston FURY Renegade Pro Black Registered DDR5-6000 CL32 128GB (4x32GB),879b6eeb-bf38-4fd8-8469-2351b0df3fa2,ram_2333,,,,,FURY,,,6000 CL32,
,ram,,,,,Kingston,,,,Kingston FURY Beast RGB White DDR5-6400 CL32 16GB (1x16GB),879eb4dd-7290-45db-991c-e02a0a8545d9,ram_2334,,,,,FURY,,,6400 CL32,
,ram,,,,,G.SKILL,,,,G.Skill Trident Z5 RGB Black DDR5-6000 CL30 32GB (2x16GB),87b0be46-ab5c-413b-b656-10a74ea269a9,ram_2335,,,,,Trident,,,6000 CL30,
,ram,,,,,Corsair,,,,Corsair Vengeance RGB 32GB (2x16GB) DDR5 6000 CL30 Black,87c2e63c-6d6d-4cf5-b0f6-8f80d60e860a,ram_2336,,,2025,,Vengeance RGB,,,6000 CL30,
,ram,,,,,G.SKILL,,,,G.Skill TridentZ RGB Black DDR4-3600 CL14 32GB (2x16GB),87c4c095-ae3b-4172-8197-3272b6f9340f,ram_2337,,,,,TridentZ,,,3600 CL14,
,ram,,,,,ADATA,,,,ADATA XPG Lancer Blade RGB Black DDR5-6000 CL30 32GB (2x16GB),87c54ef2-f459-48a2-af2c-03a68baa2d1d,ram_2338,,,,,XPG,,,6000 CL30,
,ram,,,,,Corsair,,,,Corsair Dominator Titanium DDR5-6600 CL32 32GB (2x16GB),87d1ace3-55cb-45ee-8396-d1fa12d1928b,ram_2339,,,,,Dominator,,,6600 CL32,
,ram,,,,,Silicon Power,,,,Silicon Power XPOWER Pulse Gaming Black / White DDR5-6400 CL32 64GB (2x32GB),87e8ddcb-ec65-4219-ac51-e24ebba1a204,ram_2340,,,,,XPOWER,,,6400 CL32,
,ram,,,,,Kingston,,,,Kingston ValueRAM Black / Green DDR4-2400 CL17 16GB (1x16GB),87ec90b4-b5c7-4bae-817c-8f27d73ea89c,ram_2341,,,,,ValueRAM,,,2400 CL17,
,ram,,,,,Kingston,,,,Kingston FURY White DDR5-5600 CL40 16GB (1x16GB),88256aab-21d8-46ac-a2c7-eae0daa22d73,ram_2342,,,,,FURY,,,5600 CL40,
,ram,,,,,G.SKILL,,,,G.Skill NT DDR4-2400 CL17 16GB (2x8GB),88760cbc-fdc7-4dc3-9cf2-9b58f8dcf30f,ram_2343,,,,,NT,,,2400 CL17,
,ram,,,,,Klevv,,,,Klevv Urbane V RGB White DDR5-6000 CL30 32GB (2x16GB),8878c52e-4847-467a-8d63-91de985b2a70,ram_2344,,,,,Urbane,,,6000 CL30,
,ram,,,,,TEAMGROUP,,,,TEAMGROUP T-Force Delta RGB Black DDR5-5200 CL40 16GB (1x16GB),887a7c62-78cb-4d15-9cc8-284d29ba9b2c,ram_2345,,,,,T-Force,,,5200 CL40,
,ram,,,,,G.SKILL,,,,G.Skill Value Black DDR3-1333 CL9 16GB (2x8GB),8891249a-1570-488e-91ce-c5d652c729f5,ram_2346,,,,,Value,,,1333 CL9,
,ram,,,,,Kingston,,,,Kingston FURY Beast Black DDR5-6400 CL32 32GB (1x32GB),88c4162e-c92f-41af-b472-9395ea43ff9f,ram_2347,,,,,FURY,,,6400 CL32,
,ram,,,,,Crucial,,,,Crucial Ballistix Sport LT Gray DDR4-2666 CL16 16GB (2x8GB),88f19bd6-a341-4ed9-b818-75672fb1d817,ram_2348,,,,,Ballistix,,,2666 CL16,
,ram,,,,,TEAMGROUP,,,,TEAMGROUP T-Force Dark Za Black / Silver DDR4-3600 CL18 32GB (2x16GB),8900ed35-471e-4f73-b639-ea7e88431ea4,ram_2349,,,,,T-Force,,,3600 CL18,
,ram,,,,,G.SKILL,,,,G.Skill Ripjaws V Red DDR4-3200 CL14 64GB (2x32GB),890e53a7-47c5-48b7-bd56-8bcffb690cbb,ram_2350,,,,,Ripjaws,,,3200 CL14,
,ram,,,,,Silicon Power,,,,Silicon Power SP016GXLZU320BDAAD Black / Silver DDR4-3200 CL16 16GB (2x8GB),89334d9f-f178-48a4-a13b-1706401bbc88,ram_2351,,,,,SP016GXLZU320BDAAD,,,3200 CL16,
,ram,,,,,Kingston,,,,Kingston FURY Beast Black DDR5-5600 CL40 128GB (2x64GB),893396cd-4bf5-44f7-a113-ad822d4447f4,ram_2352,,,,,FURY,,,5600 CL40,
,ram,,,,,TEAMGROUP,,,,TEAMGROUP T-Force Vulcan Z Silver / Black DDR4-3000 CL16 32GB (2x16GB),894d17cb-0266-4653-9030-30c9a3e50861,ram_2353,,,,,T-Force,,,3000 CL16,
,ram,,,,,ADATA,,,,ADATA XPG Lancer Blade RGB White DDR5-6000 CL30 32GB (1x32GB),895570b5-7ceb-44e0-8092-c0b82c5b2fe7,ram_2354,,,,,XPG,,,6000 CL30,
,ram,,,,,Patriot,,,,Patriot Viper Steel Gray DDR4-3600 CL18 32GB (1x32GB),896c9a39-5d6b-4c0d-90d0-ef0b728598a4,ram_2355,,,,,Viper,,,3600 CL18,
,ram,,,,,Patriot,,,,Patriot Viper Elite 5 RGB White DDR5-6000 CL42 96GB (2x48GB),898c18a6-bd66-46b4-95c8-9b56fdeb846e,ram_2356,,,,,Viper,,,6000 CL42,
,ram,,,,,Crucial,,,,Crucial CT8G52C42S5 Black DDR5 SODIMM-5200 CL42 8GB (1x8GB),89d946a7-9d58-44f0-ad62-2ec8134e733b,ram_2357,,,,,CT8G52C42S5,,,5200 CL42,
,ram,,,,,Silicon Power,,,,Silicon Power SP032GBLVU480F02 DDR5-4800 CL40 32GB (1x32GB),89d982e3-cb71-4a77-a50f-119cf4e430ad,ram_2358,,,,,SP032GBLVU480F02,,,4800 CL40,
,ram,,,,,Corsair,,,,Corsair Vengeance LPX DDR4-2666 CL16 8GB (1x8GB),89e9f114-5786-4e8a-987c-03a87d55c8a7,ram_2359,,,,,Vengeance,,,2666 CL16,
,ram,,,,,G.SKILL,,,,G.Skill Trident Z5 RGB White / Black DDR5-6000 CL30 64GB (2x32GB),8a0c6340-b4e6-40e4-be2f-b05f453b59be,ram_2360,,,,,Trident,,,6000 CL30,
,ram,,,,,Corsair,,,,DOMINATOR PLATINUM RGB 32GB (2 x 16GB) DDR4 DRAM 3200MHz C16 Memory Kit,8a0c9cba-fac2-48ab-b28d-2554d5e937ed,ram_2361,,,2019,,DOMINATOR PLATINUM RGB,,,3200MHz CL16,
,ram,,,,,Crucial,,,,Crucial Pro Black DDR5-5600 CL46 48GB (2x24GB),8a124d1b-041d-4e4e-bd64-432931252d40,ram_2362,,,,,Pro,,,5600 CL46,
,ram,,,,,G.SKILL,,,,G.Skill Ripjaws M5 RGB White DDR5-6400 CL32 32GB (2x16GB),8a1c4484-fc84-4f96-a65c-c7a2a0340ed7,ram_2363,,,,,Ripjaws,,,6400 CL32,
,ram,,,,,G.SKILL,,,,G.Skill Trident Z RGB Black DDR4-3600 CL18 64GB (2x32GB),8a33cd22-dd2a-45c0-89f0-5e0c525ee0ac,ram_2364,,,,,Trident,,,3600 CL18,
,ram,,,,,Samsung,,,,Samsung M393A4K40BB1-CRC Registered Green DDR4-2400 CL17 32GB (1x32GB),8a36de43-b44c-451e-8f06-905df6cb483d,ram_2365,,,,,M393A4K40BB1-CRC,,,2400 CL17,
,ram,,,,,v-color,,,,V-Color Manta XPrism RGB DDR5-5600 CL36 32GB (2x16GB),8a53acca-b2d6-4117-9d57-03c594bb1688,ram_2366,,,,,Manta,,,5600 CL36,
