cas_latency,category,color,ecc,form_factor,lighting,manufacturer,manufacturer_color,modules_capacity_gb,modules_quantity,name,opendb_id,part_id,ram_type,registered,release_year,rgb,series,speed,total_capacity_gb,variant,voltage
,ram,,,,,Corsair,,,,Corsair Dominator Platinum RGB 128GB (8x16GB) DDR4 3200MHz C16 1.35V DIMM (XMP 2.0) White Heatspreaders Desktop PC Gaming Memory,3b1e075f-ea3e-4289-b8b6-d0d29ea4a00a,ram_1017,,,0,,Dominator Platinum RGB,,,3200MHz C16,
,ram,,,,,Kingston,,,,Kingston FURY Renegade Pro Black Registered DDR5-6400 CL32 128GB (8x16GB),3b2240f8-420c-408a-8f1b-3bfb7497e746,ram_1018,,,,,FURY,,,6400 CL32,
,ram,,,,,GeIL,,,,GeIL Polaris Black DDR5-5200 CL34 32GB (2x16GB),3b247cb6-e58e-4b4c-94fe-7c030913a1cd,ram_1019,,,,,Polaris,,,5200 CL34,
,ram,,,,,TEAMGROUP,,,,TEAMGROUP T-Force Delta RGB Black DDR4 32GB(2x16GB) 3600MHz CL14,3b274196-2f1d-4081-a262-5229ed12988e,ram_1020,,,,,T-Force,,,Delta RGB BLACK DDR4,
,ram,,,,,TEAMGROUP,,,,TEAMGROUP T-Force Dark Red / Black DDR4-2666 CL15 4GB (1x4GB),3b2965f3-7d18-4d58-9ddb-abbe93107a32,ram_1021,,,,,T-Force,,,2666 CL15,
,ram,,,,,Patriot,,,,Patriot Signature Line DDR4-3200 CL22 32GB (1x32GB),3b35daa5-a69e-44a9-9f4f-f7bbcafa3404,ram_1022,,,,,Signature,,,3200 CL22,
,ram,,,,,Corsair,,,,Corsair ValueSelect Black DDR4-2133 CL15 16GB (1x16GB),3b3930e1-f6e4-4f51-ba70-a2045c390c3a,ram_1023,,,,,ValueSelect,,,2133 CL15,
,ram,,,,,Acer,,,,Acer Predator Hera RGB DDR5-8200 CL36 32GB (2x16GB),3b3fdf1e-f965-4c8c-b974-6870986b6bf1,ram_1024,,,,,Predator,,,8200 CL36,
,ram,,,,,PNY,,,,PNY XLR8 Gaming EPIC-X RGB White DDR4-3200 CL16 32GB (2x16GB),3b407cd0-e687-4d7d-94b4-ec1004e28f02,ram_1025,,,,,XLR8,,,3200 CL16,
,ram,,,,,G.SKILL,,,,G.Skill Ripjaws S5 Black DDR5-6000 CL32 64GB (2x32GB),3b443143-4fad-497c-ad42-86edbc059133,ram_1026,,,,,Ripjaws,,,6000 CL32,
,ram,,,,,Thermaltake,,,,Thermaltake TOUGHRAM XG RGB Black / Silver DDR4-3600 CL18 32GB (2x16GB),3b4995f8-e9ff-467f-9618-1e26a63d637d,ram_1027,,,,,TOUGHRAM,,,3600 CL18,
,ram,,,,,Kingston,,,,Kingston FURY Beast RGB White DDR5-5600 CL36 32GB (2x16GB),3b5060af-0f0d-4ec6-8621-fa87656d7ea0,ram_1028,,,,,FURY,,,5600 CL36,
,ram,,,,,v-color,,,,V-Color Prism Pro Black DDR4-3600 CL18 16GB (2x8GB),3b51d153-0084-405a-bc77-de8456e21e01,ram_1029,,,,,Prism,,,3600 CL18,
,ram,,,,,Lexar,,,,Lexar Ares RGB Black DDR4-3600 CL18 16GB (2x8GB),3b55a763-e903-4eec-add9-b236561c7a73,ram_1030,,,,,Ares,,,3600 CL18,
,ram,,,,,TEAMGROUP,,,,TEAMGROUP T-Force Vulcan Z Gray DDR4-3200 CL16 64GB (2x32GB),3b574cb9-8944-431b-a965-3f11cfcc6d29,ram_1031,,,,,T-Force,,,3200 CL16,
,ram,,,,,G.SKILL,,,,G.Skill Ripjaws M5 RGB Black DDR5-6000 CL30 32GB (2x16GB),3b64337c-e5a0-4673-bf2a-06f872c2fdf1,ram_1032,,,,,Ripjaws,,,6000 CL30,
,ram,,,,,Kingston,,,,Kingston HyperX Predator Black DDR4-3000 CL15 16GB (2x8GB),3b687d57-5b94-4058-8216-918e525f4ab7,ram_1033,,,,,HyperX,,,3000 CL15,
,ram,,,,,G.SKILL,,,,G.Skill Ripjaws Black DDR4-4266 CL19 32GB (2x16GB),3b6899c3-b573-479d-9d09-c4a8cd315fdf,ram_1034,,,,,Ripjaws,,,4266 CL19,
,ram,,,,,G.SKILL,,,,G.Skill Trident Z5 Neo RGB Black / Silver DDR5-6000 CL30 64GB (2x32GB),3b7b50d2-d3c0-4520-8371-734a303ebee4,ram_1035,,,,,Trident,,,6000 CL30,
,ram,,,,,TEAMGROUP,,,,TEAMGROUP T-Force Vulcan DDR5 16GB (2x8GB) 5200MHz (PC5-41600) CL40 Intel XMP 3.0 & AMD Expo Compatible Desktop Memory Module Ram Black FLBD516G5200HC40CDC01,3b7e3d22-07c3-4db9-ba41-0f4bb1b2ea20,ram_1036,,,2023,,T-Force Vulcan,,,5200MHz,
,ram,,,,,Corsair,,,,Corsair Vengeance RGB 32GB (2x16GB) DDR5 5600 CL40 Black,3b851fb0-d6ff-4fc7-877e-9f9834542673,ram_1037,,,2022,,Vengeance RGB,,,5600 CL40,
,ram,,,,,Corsair,,,,Corsair Vengeance RGB RT DDR4-3200 CL16 64GB (2x32GB),3b9ef05b-0bd6-424a-be33-f723cdc5a984,ram_1038,,,,,Vengeance,,,3200 CL16,
,ram,,,,,Patriot,,,,Patriot Signature Line DDR4-3200 CL22 16GB (1x16GB),3b9fbd2f-24b2-4fc0-9f10-e8862844be8d,ram_1039,,,,,Signature,,,3200 CL22,
,ram,,,,,ADATA,,,,ADATA XPG SPECTRIX D35G RGB White DDR4-3200 CL16 64GB (2x32GB),3bac9249-cb7f-4575-9af4-7dee018856b5,ram_1040,,,,,XPG,,,3200 CL16,
,ram,,,,,Klevv,,,,Klevv Urbane V RGB White DDR5-6000 CL30 48GB (2x24GB),3bad2f91-72a4-419e-a697-18c96068087a,ram_1041,,,,,Urbane,,,6000 CL30,
,ram,,,,,Kingston,,,,Kingston HyperX Fury Black / White DDR4-2400 CL15 8GB (1x8GB),3bae2f01-e14b-41b5-b316-4024b9b649c3,ram_1042,,,,,HyperX,,,2400 CL15,
,ram,,,,,Corsair,,,,Corsair Vengeance Black / Silver DDR3-1600 CL10 8GB (1x8GB),3bb2ea4d-c053-4bd6-9489-1a486e2977d7,ram_1043,,,,,Vengeance,,,1600 CL10,
,ram,,,,,Corsair,,,,Corsair Vengeance LPX Red DDR4-3200 CL16 16GB (2x8GB),3bc16621-92d0-46ac-8d9c-fe057d82ef15,ram_1044,,,,,Vengeance,,,3200 CL16,
,ram,,,,,Kingston,,,,Kingston HyperX Fury Black DDR4-3466 CL17 64GB (2x32GB),3bc2d984-6a34-4a13-a75f-cfdffbebe14e,ram_1045,,,,,HyperX,,,3466 CL17,
,ram,,,,,Corsair,,,,Corsair Vengeance RGB Pro DDR4-3200 CL16 128GB (4x32GB),3bc695c0-1865-498f-8464-c510d44349fb,ram_1046,,,,,Vengeance,,,3200 CL16,
,ram,,,,,Crucial,,,,Crucial Ballistix Sport LT DDR4-3200 CL16 32GB (2x16GB),3bc7e96a-ce86-435c-8c58-82bcba60361a,ram_1047,,,,,Ballistix,,,3200 CL16,
,ram,,,,,PROXMEM,,,,PROXMEM KERBEROS Black Silver DDR5-5600 CL36 32GB (2x16GB),3bc7ee34-51ec-42fa-b082-72f9a1dededb,ram_1048,,,,,KERBEROS,,,5600 CL36,
,ram,,,,,Kingston,,,,Kingston FURY Beast Black / Silver DDR5-6000 CL40 16GB (1x16GB),3bd2e869-1d39-4be8-a3a5-a60ad705ccd6,ram_1049,,,,,FURY,,,6000 CL40,
,ram,,,,,Gigastone,,,,GIGASTONE Game PRO 64GB Kit (4x16GB) DDR4 3600MHz White CL18,3bdb2100-f7eb-4bc1-beb3-a9624171f93d,ram_1050,,,,,Game PRO,,,3600 CL18,
,ram,,,,,Corsair,,,,Corsair Vengeance RGB Black / Gray DDR5-6400 CL32 64GB (4x16GB),3be0b033-c6ec-465d-bfcf-f95d937ed7ea,ram_1051,,,,,Vengeance,,,6400 CL32,
,ram,,,,,G.SKILL,,,,G.Skill Trident Z5 RGB Silver / Black DDR5-6000 CL36 32GB (2x16GB),3bfbe0b8-6bf2-43c8-a909-63e54b91f28f,ram_1052,,,,,Trident,,,6000 CL36,
,ram,,,,,Silicon Power,,,,Silicon Power XPOWER Pulse Gaming Black / White DDR5-6800 CL34 32GB (2x16GB),3bfe46dd-5ed3-46e3-8755-a13e97d78c57,ram_1053,,,,,XPOWER,,,6800 CL34,
,ram,,,,,PNY,,,,PNY Anarchy X Black / Red DDR3-2666 CL12 16GB (2x8GB),3c118d0a-763d-4732-aae7-1ac8ed554d86,ram_1054,,,,,Anarchy,,,2666 CL12,
,ram,,,,,TEAMGROUP,,,,TEAMGROUP T-Force Delta RGB DDR4 32GB (2x16GB) 2666MHz CL16 WHITE,3c19e6b3-21c4-4eb5-b901-16bd458a7040,ram_1055,,,,,T-Force,,,Delta RGB White DDR4,
,ram,,,,,Corsair,,,,Corsair Dominator Titanium Black DDR5-6000 CL30 48GB (2x24GB),3c370953-15e9-4147-bddc-16518462b46f,ram_1056,,,,,Dominator,,,6000 CL30,
,ram,,,,,G.SKILL,,,,G.Skill Trident Z5 RGB White / Black DDR5-6600 CL34 32GB (2x16GB),3c584193-6b7d-4050-b2a1-00fe27ab456b,ram_1057,,,,,Trident,,,6600 CL34,
,ram,,,,,PNY,,,,PNY Anarchy X Black / Blue DDR3-2400 CL11 8GB (2x4GB),3c599c83-c228-4aa8-b385-4bd65cf58b44,ram_1058,,,,,Anarchy,,,2400 CL11,
,ram,,,,,OLOy,,,,OLOy Blade RGB DDR5-6800 CL40 32GB (2x16GB),3c6514a3-481b-4769-9ad0-ff9f15f9ab43,ram_1059,,,,,Blade,,,6800 CL40,
,ram,,,,,Patriot,,,,Patriot Viper Red / Black DDR4-2666 CL16 16GB (1x16GB),3c68eca2-dc41-45c7-8965-0d5e410b78a3,ram_1060,,,,,Viper,,,2666 CL16,
,ram,,,,,Patriot,,,,Patriot Viper Venom Black / White DDR5-7000 CL32 32GB (2x16GB),3c6af1bd-460d-4764-82ba-efe1939cb4fa,ram_1061,,,,,Viper,,,7000 CL32,
,ram,,,,,Corsair,,,,Corsair Dominator Black / Blue DDR2-1066 CL5 4GB (2x2GB),3c8f3f35-fe4c-42c1-b13f-6843373dc247,ram_1062,,,,,Dominator,,,1066 CL5,
,ram,,,,,Patriot,,,,Patriot Viper Red / Black DDR4-3600 CL20 64GB (2x32GB),3c963248-5100-4de0-9437-dc70983d8c17,ram_1063,,,,,Viper,,,3600 CL20,
,ram,,,,,G.SKILL,,,,G.Skill F4-3200C16Q2-128GTZ Gray / Red DDR4-3200 CL16 128GB (8x16GB),3c9ca8d9-8ff3-4491-b962-750770cbe4b5,ram_1064,,,,,F4-3200C16Q2-128GTZ,,,3200 CL16,
,ram,,,,,TEAMGROUP,,,,TEAMGROUP Elite Black DDR5-5200 CL42 32GB (2x16GB),3ca1f00a-ee6d-42c9-a9c2-cdfde8efd8a1,ram_1065,,,,,Elite,,,5200 CL42,
,ram,,,,,TEAMGROUP,,,,TEAMGROUP T-Force Delta RGB Black DDR5-6000 CL38 32GB (1x32GB),3ca3ba0f-cf3d-4b85-9f9d-cdfd067038d9,ram_1066,,,,,T-Force,,,6000 CL38,
,ram,,,,,G.SKILL,,,,G.Skill Trident Z Royal Gold DDR4-3600 CL18 256GB (8x32GB),3ca79083-c0d4-4e8b-8b91-1a95af5db21d,ram_1067,,,,,Trident,,,3600 CL18,
,ram,,,,,Crucial,,,,Crucial Ballistix RGB DDR4-3200 CL16 16GB (2x8GB),3cadea9c-ae76-4f64-9853-e0fca77cf528,ram_1068,,,,,Ballistix,,,3200 CL16,
,ram,,,,,Kingston,,,,Kingston FURY Beast Black DDR4-2666 CL16 4GB (1x4GB),3cc912aa-1c9d-4bd3-9286-cdfa6bc041b2,ram_1069,,,,,FURY,,,2666 CL16,
,ram,,,,,Silicon Power,,,,Silicon Power SP048GBSVU560P02 Black SODIMM DDR5-5600 CL46 48GB (1x48GB),3cd7c914-d850-4f20-93ea-624dd261c43e,ram_1070,,,,,SP048GBSVU560P02,,,5600 CL46,
,ram,,,,,Corsair,,,,Corsair Vengeance RGB Pro Black DDR4-4000 CL18 32GB (2x16GB),3ce6cdf5-f8ec-41cf-b4ac-13e955a4f6a8,ram_1071,,,,,Vengeance,,,4000 CL18,
,ram,,,,,Crucial,,,,Crucial CT32G4DFD832A Green / Black DDR4-3200 CL22 32GB (1x32GB),3cef94bd-b20e-43ae-8f90-afad05c4063b,ram_1072,,,,,CT32G4DFD832A,,,3200 CL22,
,ram,,,,,GeIL,,,,GeIL ORION V RGB AMD DDR5-6000 CL38 32GB (2x16GB),3cfef291-c438-4c49-ab69-82c6b7152bd0,ram_1073,,,,,ORION,,,6000 CL38,
,ram,,,,,Kingston,,,,Kingston Fury Beast RGB Special Edition White DDR4-3200 CL16 8GB (1x8GB),3d117b13-abff-4f77-b16b-d2f2fbc1530e,ram_1074,,,,,Fury,,,3200 CL16,
,ram,,,,,Kingston,,,,Kingston Server Premier DDR4-2666 CL19 16GB (1x16GB),3d416ff3-526f-4235-a364-cfa08088e123,ram_1075,,,,,Server,,,2666 CL19,
,ram,,,,,Crucial,,,,Crucial CT16G4DFD8213 Green DDR4-2133 CL15 16GB (1x16GB),3d4b31ba-e667-4bdf-86c7-0132441e1788,ram_1076,,,,,CT16G4DFD8213,,,2133 CL15,
,ram,,,,,G.SKILL,,,,G.Skill Ripjaws Black / Red DDR4-2400 CL15 16GB (4x4GB),3d5ce36d-9fc4-4fb3-b037-19636e10133b,ram_1077,,,,,Ripjaws,,,2400 CL15,
,ram,,,,,v-color,,,,V-Color ECC Registered DIMM 512GB (8x64GB) DDR5 6000 CL36 Black,3d5eb2d6-4821-4f02-a821-96895ddbfee7,ram_1078,,,2024,,OC R-DIMM AMD WRX90,,,6000 CL36,
,ram,,,,,Patriot,,,,Patriot Viper Venom Black / White DDR5-5600 CL40 16GB (2x8GB),3d6726c2-2121-48cd-87af-e0c2a3ca2dbf,ram_1079,,,,,Viper,,,5600 CL40,
,ram,,,,,G.SKILL,,,,G.Skill Trident Z RGB Black DDR4-4000 CL17 32GB (4x8GB),3d7f4cf4-398f-4fa4-bd47-54f4847e3443,ram_1080,,,,,Trident,,,4000 CL17,
,ram,,,,,Mushkin,,,,Mushkin Redline Black SODIMM DDR5-4800 CL40 96GB (2x48GB),3da98044-234c-41a3-807b-3a0c17698924,ram_1081,,,,,Redline,,,4800 CL40,
,ram,,,,,PNY,,,,PNY NHS Black / Green SODIMM DDR3-1600 CL11 8GB (1x8GB),3dab8f82-9f57-4a24-8046-5ccd4602740d,ram_1082,,,,,NHS,,,1600 CL11,
,ram,,,,,Kingston,,,,Kingston HX426C13PBK4/32 Black DDR4-2666 CL13 32GB (4x8GB),3db763c4-fc50-4f24-91a9-66eb28553312,ram_1083,,,,,HX426C13PBK4/32,,,2666 CL13,
,ram,,,,,OLOy,,,,OLOy DDR4 RAM 16GB (2x8GB) 3000 MHz CL16 1.35V 288-Pin Desktop Gaming UDIMM,3dbb8855-3109-42fe-b361-26c3e673542b,ram_1084,,,0,,,,,3000 MHz CL16,
,ram,,,,,Patriot,,,,Patriot Viper Elite 5 RGB DDR5-6600 CL36 32GB (2x16GB),3dc8dd06-df4b-462e-a914-e472635137df,ram_1085,,,,,Viper,,,6600 CL36,
,ram,,,,,Mushkin,,,,Mushkin Essentials Black / Green DDR3-1600 CL11 32GB (4x8GB),3dceea46-04b1-48d4-b9c8-61f744e838a2,ram_1086,,,,,Essentials,,,1600 CL11,
,ram,,,,,Kingston,,,,Kingston FURY Impact Black SODIMM DDR4-3200 CL20 32GB (2x16GB),3deecb8e-68aa-44ce-b437-095826b1203d,ram_1087,,,,,FURY,,,3200 CL20,
,ram,,,,,Corsair,,,,Corsair Vengeance LPX Black / Yellow DDR4-3200 CL16 16GB (1x16GB),3e04aaef-47bc-4eca-bbaf-15e0298161ab,ram_1088,,,,,Vengeance,,,3200 CL16,
,ram,,,,,G.SKILL,,,,G.Skill Trident Z5 Neo RGB 256GB (4x64GB) DDR5 6000 CL36 Black,3e10b532-73f4-43c9-89ba-f7c9c89e75c4,ram_1089,,,2025,,Trident Z5 Neo,,,6000 CL36,
,ram,,,,,Corsair,,,,Corsair Dominator RGB White DDR4-4000 CL19 32GB (2x16GB),3e1661c8-bc69-4a51-9a7d-f38ad85e74e1,ram_1090,,,,,Dominator,,,4000 CL19,
,ram,,,,,TEAMGROUP,,,,TEAMGROUP T-Force Xtreem DDR5-6400 CL32 32GB (2x16GB),3e1cd81c-ede8-48b5-82bd-567dbac0e581,ram_1091,,,,,T-Force,,,6400 CL32,
,ram,,,,,Patriot,,,,Patriot Viper RGB White DDR4-4133 C19,3e1efee3-936d-41d5-afe7-eb8417b0c71f,ram_1092,,,2020,,Viper RGB,,,DDR4-4133 C19,
,ram,,,,,G.SKILL,,,,G.Skill Trident Z Royal Silver DDR4-3200 CL16 32GB (4x8GB),3e2092f5-c579-47c2-acbe-ff4cbf123998,ram_1093,,,,,Trident,,,3200 CL16,
,ram,,,,,Silicon Power,,,,Silicon Power XPOWER Zenith RGB Gaming Black DDR5-6000 CL40 32GB (2x16GB),3e4fb956-435e-45a6-852b-985849993463,ram_1094,,,,,XPOWER Zenith RGB,,,6000 CL40,
,ram,,,,,Kingston,,,,Kingston KVR1333D3N9HK4/32G Green DDR3-1333 CL9 32GB (4x8GB),3e617d0a-19db-4e98-bde9-06c5cbc8dd30,ram_1095,,,,,KVR1333D3N9HK4/32G,,,1333 CL9,
,ram,,,,,G.SKILL,,,,G.Skill Ripjaws Red DDR4-2666 CL15 32GB (2x16GB),3e62296a-848a-43a6-b79d-3def17e1847c,ram_1096,,,,,Ripjaws,,,2666 CL15,
,ram,,,,,Silicon Power,,,,Silicon Power XPOWER Pulse Gaming Black / White DDR5-6000 CL30 32GB (1x32GB),3e649f88-1d2d-4349-89f3-1ef1ec365450,ram_1097,,,,,XPOWER,,,6000 CL30,
,ram,,,,,Samsung,,,,Samsung M393A4K40CB2-CTD Registered Green / Black DDR4-2666 CL19 32GB (1x32GB),3e6e61ab-e936-4ef1-a68a-1036ed8f5b8f,ram_1098,,,,,M393A4K40CB2-CTD,,,2666 CL19,
,ram,,,,,Patriot,,,,Patriot Signature Black / Green DDR3-1600 CL11 8GB (1x8GB),3e79f859-bfdc-4db9-95ea-285bccc892ff,ram_1099,,,,,Signature,,,1600 CL11,
,ram,,,,,OLOy,,,,OLOy DDR4 RAM 16GB (2x8GB) 3200 MHz CL16  UDIMM (MD4U0832160BHRDA) RED,3e7e2441-4169-42c1-a66a-2461bf36f8ad,ram_1100,,,2020,,DDR4,,,3200 CL16,
,ram,,,,,G.SKILL,,,,G.Skill Trident Z Neo Silver / Black DDR4-3600 CL16 32GB (4x8GB),3e93afa6-1417-4bef-b4e6-9029b0874966,ram_1101,,,,,Trident,,,3600 CL16,
,ram,,,,,Klevv,,,,Klevv CRAS V RGB DDR5-7600 CL36 32GB (2x16GB) White,3e951b68-fa7c-488c-9ac8-9349629145e5,ram_1102,,,,,CRAS,,,7600 CL36,
,ram,,,,,Corsair,,,,Corsair Vengeance RGB Black DDR5-6000 CL36 48GB (2x24GB),3e95257d-38ca-4080-84f2-53178e44b6fe,ram_1103,,,,,Vengeance,,,6000 CL36,
,ram,,,,,Apacer,,,,Apacer Panther RGB Silver / Black DDR5-5200 CL38 32GB (2x16GB),3e99548c-2166-4997-a95e-ec5c21dd753b,ram_1104,,,,,Panther,,,5200 CL38,
,ram,,,,,Corsair,,,,Corsair Vengeance LPX Black / Yellow DDR4-3600 CL18 16GB (2x8GB),3ec88fb7-7041-40bf-82ac-3c4b21c7d1c2,ram_1105,,,,,Vengeance,,,3600 CL18,
,ram,,,,,Corsair,,,,Corsair Dominator Platinum RGB Black DDR4-3200 CL16 32GB (2x16GB),3ec8df76-8f96-418d-9dac-33784d291f2f,ram_1106,,,,,Dominator,,,3200 CL16,
,ram,,,,,Acer,,,,Acer Predator Pallas II Black DDR5-6400 CL32 48GB (2x24GB),3ece3ed4-fa89-40fb-af18-24b4c4acbcec,ram_1107,,,,,Predator,,,6400 CL32,
,ram,,,,,Corsair,,,,Corsair Vengeance RGB RT DDR4-3200 CL16 16GB (2x8GB),3ed20582-0cb9-407a-a698-689e78638413,ram_1108,,,,,Vengeance,,,3200 CL16,
,ram,,,,,Kingston,,,,Kingston FURY White DDR5-5200 CL40 32GB (2x16GB),3ef3e832-2527-4b94-9ecf-5e74d9384d68,ram_1109,,,,,FURY,,,5200 CL40,
,ram,,,,,Kingston,,,,Kingston FURY Beast Black DDR4-3200 CL16 128GB (4x32GB),3ef78bf3-1487-4a00-8d33-f4ea8a0e56b4,ram_1110,,,,,FURY,,,3200 CL16,
,ram,,,,,Kingston,,,,Kingston HyperX Fury RGB Black DDR4-2666 CL16 8GB (1x8GB),3efc6c72-971f-4da1-8a8a-0b3e2045e543,ram_1111,,,,,HyperX,,,2666 CL16,
,ram,,,,,Crucial,,,,Crucial CT2K8G4DFD824A DDR4-2400 CL17 16GB (2x8GB),3f03439e-f60c-435e-b16d-de8f45204fd2,ram_1112,,,,,CT2K8G4DFD824A,,,2400 CL17,
,ram,,,,,TEAMGROUP,,,,TEAMGROUP T-Force Delta RGB Black DDR5-5600 CL40 8GB (1x8GB),3f14f928-6c29-424b-a36d-1333a98dbfe3,ram_1113,,,,,T-Force,,,5600 CL40,
,ram,,,,,ADATA,,,,ADATA XPG CASTER RGB Black / Silver DDR5-6000 CL40 16GB (1x16GB),3f2060b4-4186-4f90-b317-f55c0f74c6dc,ram_1114,,,,,XPG,,,6000 CL40,
,ram,,,,,G.SKILL,,,,G.Skill Ripjaws V DDR4-2133 CL15 32GB (2x16GB),3f362ffe-3436-40fa-bcd8-b07c8cf983bc,ram_1115,,,,,Ripjaws,,,2133 CL15,
,ram,,,,,Corsair,,,,Corsair Vengeance White DDR5-5200 CL40 32GB (2x16GB),3f3e4739-6d60-4e36-901e-04dafa0201c3,ram_1116,,,,,Vengeance,,,5200 CL40,
,ram,,,,,Crucial,,,,Crucial CT64G4LFQ424A Registered Black / Green DDR4-2400 CL17 64GB (1x64GB),3f574207-ab24-4570-87da-9080bcc0e86f,ram_1117,,,,,CT64G4LFQ424A,,,2400 CL17,
,ram,,,,,Silicon Power,,,,Silicon Power XPOWER Storm RGB DDR5-6800 CL34 64GB (2x32GB),3f6af5e2-727b-4fbd-bfbb-2ad7d030a1f3,ram_1118,,,,,XPOWER,,,6800 CL34,
,ram,,,,,Corsair,,,,Corsair Vengeance LPX Black / Yellow DDR4-3733 CL17 64GB (4x16GB),3f86f54d-d3b8-48ef-9c3a-e0ff3ad58290,ram_1119,,,,,Vengeance,,,3733 CL17,
,ram,,,,,Silicon Power,,,,Silicon Power XPOWER Zenith RGB Gaming Black DDR5-6000 CL30 64GB (2x32GB),3fac3af2-ebfc-4a00-a1fe-409aaf558c8b,ram_1120,,,,,XPOWER Zenith RGB,,,6000 CL30,
,ram,,,,,Acer,,,,Acer Predator Hera RGB Silver DDR5-6400 CL32 64GB (2x32GB),3faec867-c6a1-4396-a2e3-cdd689bd955f,ram_1121,,,,,Predator,,,6400 CL32,
,ram,,,,,G.SKILL,,,,G.Skill Trident Z5 Black DDR5-5600 CL40 32GB (2x16GB),3fbf68e2-51e3-4f6f-8df1-90809c1a79ef,ram_1122,,,,,Trident,,,5600 CL40,
,ram,,,,,Kingston,,,,Kingston FURY Beast RGB 16GB (1x16GB) DDR5 5200 CL40 White,3fd33b36-daa5-419c-b14f-dfdd3714fbc8,ram_1123,,,2023,,FURY Beast RGB,,,5200 CL40,
,ram,,,,,TEAMGROUP,,,,TEAMGROUP Elite Black DDR3-1600 CL11 4GB (1x4GB),3fd71b8b-f569-4a00-b625-244f65dd4b3e,ram_1124,,,,,Elite,,,1600 CL11,
,ram,,,,,Corsair,,,,Corsair Vengeance White / Gray DDR5-6000 CL30 48GB (2x24GB),3ffdba6e-b682-4935-b9a8-545ebc392922,ram_1125,,,,,Vengeance,,,6000 CL30,
,ram,,,,,Corsair,,,,Corsair Vengeance Black DDR5-6000 CL36 32GB (2x16GB),4003dd50-671a-494e-a9da-13b30f75e88e,ram_1126,,,,,Vengeance,,,6000 CL36,
,ram,,,,,Corsair,,,,Corsair Vengeance Black DDR5-7000 CL40 48GB (2x24GB),400b410a-ef04-4049-83f7-e5c75614fdd9,ram_1127,,,,,Vengeance,,,7000 CL40,
,ram,,,,,PNY,,,,PNY Anarchy Black / Red DDR4-2400 CL15 16GB (4x4GB),400ea673-b5a4-4c4e-89c3-bb9fcc523fed,ram_1128,,,,,Anarchy,,,2400 CL15,
,ram,,,,,Klevv,,,,Klevv Urbane V RGB White DDR5-6400 CL32 32GB (2x16GB),4027f8bf-084f-4c02-b773-ea463555dcb7,ram_1129,,,,,Urbane,,,6400 CL30,
,ram,,,,,TEAMGROUP,,,,TEAMGROUP Elite Plus Black DDR5-6000 CL48 64GB (2x32GB),402e5269-dffb-4258-ba6f-e10c5b2ad921,ram_1130,,,,,Elite,,,6000 CL48,
,ram,,,,,Silicon Power,,,,Silicon Power SP016GLLTU160N22 Green DDR3-1600 CL11 16GB (2x8GB),404c1164-8cae-4864-ae19-252a435c7cf0,ram_1131,,,,,SP016GLLTU160N22,,,1600 CL11,
,ram,,,,,Kingston,,,,Kingston FURY Beast Black DDR4-3200 CL16 8GB (1x8GB),4067c61b-7153-41a5-ade0-8097c961e9a3,ram_1132,,,,,FURY,,,3200 CL16,
,ram,,,,,TEAMGROUP,,,,TEAMGROUP Elite Plus Black DDR5-4800 CL40 8GB (1x8GB),406ee55a-ad76-4711-898c-ad77a1073eb8,ram_1133,,,,,Elite,,,4800 CL40,
,ram,,,,,Kingston,,,,Kingston KVR16N11S8K2/8 DDR3-1600 CL11 8GB (2x4GB),4080084e-f290-4fb9-a19e-7812973afddc,ram_1134,,,,,KVR16N11S8K2/8,,,1600 CL11,
,ram,,,,,Kingston,,,,Kingston FURY Beast Black DDR4-3733 CL19 32GB (2x16GB),408d441b-77c5-43d9-973a-5c7ead2fa8a1,ram_1135,,,,,FURY,,,3733 CL19,
,ram,,,,,v-color,,,,V-Color XSky RGB DDR5-6600 CL32 32GB (2x16GB),40a58a99-3cba-4e16-86e5-b86b922d1c97,ram_1136,,,,,XSky,,,6600 CL32,
,ram,,,,,Corsair,,,,Corsair Vengeance RGB Pro Black DDR4-4000 CL18 32GB (2x16GB),40a7ed10-d961-41f1-83f2-74c82c72234e,ram_1137,,,,,Vengeance,,,4000 CL18,
,ram,,,,,PNY,,,,PNY Anarchy Black / Blue DDR4-2133 CL15 8GB (1x8GB),40d5c6fa-dd30-43ef-8434-ded0dba20740,ram_1138,,,,,Anarchy,,,2133 CL15,
,ram,,,,,Corsair,,,,Corsair Vengeance RGB Pro DDR4-3000 CL15 32GB (2x16GB),40d693ac-fd07-4aa4-a0ed-a86a563a46c6,ram_1139,,,,,Vengeance,,,3000 CL15,
,ram,,,,,Klevv,,,,Klevv BOLT Black DDR4-3600 CL18 8GB (1x8GB),40eaff1e-6d92-4d51-bbb9-11c1313484ec,ram_1140,,,,,BOLT,,,3600 CL18,
,ram,,,,,G.SKILL,,,,G.Skill Trident Z RGB Black DDR4-3600 CL19 16GB (2x8GB),40ebfd6f-02e0-45b1-a5bf-579d0da0e769,ram_1141,,,,,Trident,,,3600 CL19,
,ram,,,,,Patriot,,,,Patriot Viper Venom Black / White DDR5-5200 CL36 16GB (2x8GB),40fd9411-2373-4342-b2ed-34aa3a945dc6,ram_1142,,,,,Viper,,,5200 CL36,
,ram,,,,,Patriot,,,,Patriot Viper 3 Black / Silver DDR3-1600 CL9 16GB (2x8GB),4101f856-1669-47bc-8175-9e35815a30cb,ram_1143,,,,,Viper,,,1600 CL9,
,ram,,,,,G.SKILL,,,,G.Skill Ripjaws V Black / Red DDR4-2800 CL15 16GB (2x8GB),41070fe9-59cf-4932-937f-bdc95a48cd80,ram_1144,,,,,Ripjaws,,,2800 CL15,
,ram,,,,,Corsair,,,,Corsair Vengeance LP Black / Yellow DDR3-1600 CL9 16GB (2x8GB),411b10f9-4a8c-4f41-b535-b0e91eb9b3c3,ram_1145,,,,,Vengeance,,,1600 CL9,
,ram,,,,,Corsair,,,,Corsair Vengeance RGB Pro Black DDR4-4000 CL18 128GB (4x32GB),412d4958-9404-47e9-85f6-5146a31b1ca8,ram_1146,,,,,Vengeance,,,4000 CL18,
,ram,,,,,Corsair,,,,Corsair Vengeance LPX Black / Yellow DDR4-3200 CL16 8GB (1x8GB),413f4ee3-e5d2-4d29-9965-faf1eba33241,ram_1147,,,,,Vengeance,,,3200 CL16,
,ram,,,,,Kingston,,,,Kingston FURY Beast Black DDR4-2666 CL16 32GB (2x16GB),4140616b-5de7-4cce-a794-c3616e04b2e8,ram_1148,,,,,FURY,,,2666 CL16,
,ram,,,,,Corsair,,,,Corsair Vengeance RGB RS Black DDR4-3600 CL18 8GB (1x8GB),41419d8c-c91b-4615-a641-a4db20ef796d,ram_1149,,,,,Vengeance,,,3600 CL18,
,ram,,,,,TEAMGROUP,,,,TEAMGROUP Xtreem Black DDR5-7200 CL34 48GB (2x24GB),41461c6c-2127-4d46-a3c9-fbc3329b9684,ram_1150,,,,,Xtreem,,,7200 CL34,
,ram,,,,,Corsair,,,,Corsair Vengeance RGB Black DDR4-3000 CL15 16GB (2x8GB),4158004f-53a0-4504-9707-e10ae15dca46,ram_1151,,,,,Vengeance,,,3000 CL15,
,ram,,,,,G.SKILL,,,,G.Skill Ripjaws M5 RGB White DDR5-6000 CL30 64GB (2x32GB),415a7e5b-fb9b-4b9b-a643-3855850d07e0,ram_1152,,,,,Ripjaws,,,6000 CL30,
,ram,,,,,PNY,,,,PNY Anarchy Black / Blue DDR4-2400 CL15 4GB (1x4GB),415d9c69-8636-436a-a58f-0cd64ccd820a,ram_1153,,,,,Anarchy,,,2400 CL15,
,ram,,,,,G.SKILL,,,,G.Skill Ripjaws M5 RGB White DDR5-5600 CL46 64GB (2x32GB),4171d02b-a368-4211-ae6c-1c03f8245b3b,ram_1154,,,,,Ripjaws,,,5600 CL46,
,ram,,,,,Patriot,,,,Patriot Viper Venom RGB Black / White DDR5-5600 CL36 16GB (1x16GB),417d13c7-0309-4d43-928b-cf1a36141a2b,ram_1155,,,,,Viper,,,5600 CL36,
,ram,,,,,Corsair,,,,Corsair Dominator Platinum RGB Black DDR5-6400 CL38 32GB (2x16GB),4186c5c2-d7c2-4d7e-a390-bed1b175e07c,ram_1156,,,,,Dominator,,,6400 CL38,
,ram,,,,,Klevv,,,,Klevv Urbane V RGB White DDR5-8400 CL40 48GB (2x24GB),41886f4b-754e-4fe4-b8ae-fc3fb2647337,ram_1157,,,,,Urbane,,,8400 CL40,
,ram,,,,,Crucial,,,,Crucial CT8G4RFS824A Registered Green / Black DDR4-2400 CL17 8GB (1x8GB),41891260-1385-42c3-99f5-1c8b015f5f13,ram_1158,,,,,CT8G4RFS824A,,,2400 CL17,
,ram,,,,,G.SKILL,,,,G.Skill Trident Silver / White DDR4-3200 CL14 16GB (2x8GB),418dc156-be4b-4cbb-ab30-21eaaa42be52,ram_1159,,,,,Trident,,,3200 CL14,
,ram,,,,,G.SKILL,,,,G.Skill Ripjaws M5 Neo RGB White DDR5-6000 CL28 32GB (2x16GB),41961d70-d7a6-4ab4-99c6-a9f8102e09ae,ram_1160,,,,,Ripjaws,,,6000 CL28,
,ram,,,,,Patriot,,,,Patriot Signature Premium 32GB DDR4 3200 MHz UDIMM Memory Kit (2 x 16GB),419676bb-f2d9-4467-87e9-ad6be547286b,ram_1161,,,0,,Signature Line Premium,,,,
,ram,,,,,G.SKILL,,,,G.Skill Trident Z RGB Black DDR4-2400 CL15 16GB (2x8GB),41b183ed-cf37-44e7-a429-334dfe384eb3,ram_1162,,,,,Trident,,,2400 CL15,
,ram,,,,,G.SKILL,,,,G.Skill Trident Z RGB Silver / Black DDR5-6400 CL32 96GB (2x48GB),41bfe3ff-8ac3-4e63-b110-df0c4df6a4da,ram_1163,,,,,Trident,,,6400 CL32,
,ram,,,,,Crucial,,,,Crucial CT16G48C40U5 Black DDR5-4800 CL40 16GB (1x16GB),41c8108c-4973-466e-9341-e85192a0ee4a,ram_1164,,,,,CT16G48C40U5,,,4800 CL40,
,ram,,,,,G.SKILL,,,,G.Skill Sniper Black / Red DDR3-1866 CL9 16GB (2x8GB),41d15820-8ce0-4773-b82f-b0f79d797963,ram_1165,,,,,Sniper,,,,
,ram,,,,,Kingston,,,,Kingston ValueRAM DDR5-4800 CL40 16GB (1x16GB),41d30e5c-1396-40c7-969e-a010525aceb0,ram_1166,,,,,ValueRAM,,,4800 CL40,
,ram,,,,,TEAMGROUP,,,,TEAMGROUP T-Force Delta RGB Black DDR5-5200 CL40 16GB (2x8GB),41f1a15b-b9fe-43c1-a523-c6b7d6cf6603,ram_1167,,,,,T-Force,,,5200 CL40,
,ram,,,,,TEAMGROUP,,,,TEAMGROUP T-Force Vulcan Z Red / Black DDR4-3000 CL16 8GB (1x8GB),4217be66-6a26-473e-aa91-a5e207dc6888,ram_1168,,,,,T-Force,,,3000 CL16,
,ram,,,,,PNY,,,,PNY Anarchy Black / Blue DDR3-2133 CL10 32GB (4x8GB),42193d0b-0738-4ec4-b1d6-130997336136,ram_1169,,,,,Anarchy,,,2133 CL10,
,ram,,,,,Crucial,,,,Crucial CT16G52C42S5 Black SODIMM DDR5-5200 CL42 16GB (1x16GB),42379b54-ed8c-4fe4-88e5-4ebb93597883,ram_1170,,,,,CT16G52C42S5,,,5200 CL42,
,ram,,,,,Kingston,,,,Kingston FURY Beast White DDR5-6000 CL30 32GB (1x32GB),424b613f-5230-43f0-a0f6-7f3ce2f68374,ram_1171,,,,,FURY,,,6000 CL30,
,ram,,,,,G.SKILL,,,,G.Skill Ripjaws Blue / Black SODIMM DDR4-3200 CL22 64GB (2x32GB),426ecf9a-5a34-4798-8d57-3375c72dc10c,ram_1172,,,,,Ripjaws,,,3200 CL22,
,ram,,,,,Corsair,,,,Corsair Vengeance LPX Black / Yellow DDR4-2666 CL16 16GB (2x8GB),4271cc33-9680-4512-8b66-6f59acef2318,ram_1173,,,,,Vengeance,,,2666 CL16,
,ram,,,,,G.SKILL,,,,G.Skill Ripjaws Black DDR4-4600 CL19 32GB (2x16GB),427f52dc-d318-454e-ab30-9ac6697e609f,ram_1174,,,,,Ripjaws,,,4600 CL19,
,ram,,,,,G.SKILL,,,,G.Skill Trident Z5 RGB Black DDR5-6400 CL32 32GB (2x16GB),42866fb2-a1d2-4556-a7d8-bd838d113f92,ram_1175,,,,,Trident,,,6400 CL32,
,ram,,,,,Corsair,,,,Corsair Vengeance Black DDR5-6400 CL32 32GB (2x16GB),429faa3b-c5bd-4643-89b6-e4d4457949ce,ram_1176,,,,,Vengeance,,,6400 CL32,
,ram,,,,,Silicon Power,,,,Silicon Power XPOWER Pulse Gaming Black / White DDR5-5600 CL40 32GB (1x32GB),42b1739a-e9ce-44c4-9635-bfe34453b360,ram_1177,,,,,XPOWER,,,5600 CL40,
,ram,,,,,TEAMGROUP,,,,TEAMGROUP T-Force Delta RGB Black DDR5-6400 CL34 64GB (2x32GB),42b36cee-7336-44b8-bbc5-87049fa11c27,ram_1178,,,,,T-Force,,,6400 CL34,
,ram,,,,,Corsair,,,,Corsair Vengeance RGB RS DDR4-3600 CL18 64GB (2x32GB),42bb6b85-bec0-4fd7-ac0d-6ea680ac04f1,ram_1179,,,,,Vengeance,,,3600 CL18,
,ram,,,,,G.SKILL,,,,G.Skill Ripjaws M5 RGB Black DDR5-5200 CL40 96GB (2x48GB),42c2aa72-d471-43a5-b0ba-0e10a79bd281,ram_1180,,,2024,,Ripjaws,,,5200 CL40,
,ram,,,,,G.SKILL,,,,G.Skill Trident Z Neo Black / Silver DDR4-3600 CL18 32GB (2x16GB),42eef9f1-4795-4a8c-abb7-0ccc5cf36715,ram_1181,,,,,Trident,,,3600 CL18,
,ram,,,,,Corsair,,,,Corsair Vengeance RGB Pro Black DDR4-4700 CL19 16GB (2x8GB),430f52a7-5629-472d-92dc-43795a6947e0,ram_1182,,,,,Vengeance,,,4700 CL19,
,ram,,,,,TEAMGROUP,,,,TEAMGROUP T-Force Delta RGB Black DDR4 16GB(2x8GB) 4000MHz CL16,43202478-379e-415e-b9dc-3e0e54ccdfdd,ram_1183,,,,,T-Force,,,Delta RGB BLACK DDR4,
,ram,,,,,TEAMGROUP,,,,TEAMGROUP T-Force Vulcan Z Red DDR4-3600 CL18 16GB (2x8GB),4327c4ec-f1e8-418c-a2f2-48add4bf7ddf,ram_1184,,,,,T-Force,,,3600 CL18,
