cas_latency,category,color,ecc,form_factor,lighting,manufacturer,manufacturer_color,modules_capacity_gb,modules_quantity,name,opendb_id,part_id,ram_type,registered,release_year,rgb,series,speed,total_capacity_gb,variant,voltage
,ram,,,,,TEAMGROUP,,,,TEAMGROUP T-Create Expert Black / Gold DDR5-6400 CL32 48GB (2x24GB),000c0c27-8b0a-4760-92ec-89ef39e630d8,ram_0001,,,,,T-Create,,,6400 CL32,
,ram,,,,,TEAMGROUP,,,,TEAMGROUP T-Force Xtreem Pink DDR5-6800 CL34 48GB (2x24GB),001a1e21-a4f0-4c44-aadd-8e7af7203a2e,ram_0002,,,,,T-Force,,,6800 CL34,
,ram,,,,,Crucial,,,,Crucial CP2K64G56C46U5 Black DDR5-5600 CL46 128GB (2x64GB),001b8acb-1e90-4025-bc27-4d99540aee45,ram_0003,,,,,CP2K64G56C46U5,,,5600 CL46,
,ram,,,,,TEAMGROUP,,,,TEAMGROUP T-Force Delta RGB DDR4 16GB (1x16GB) 2666MHz CL16 WHITE,00224914-6d49-493d-8fda-5d0bfd2b087a,ram_0004,,,,,T-Force,,,Delta RGB White DDR4,
,ram,,,,,Silicon Power,,,,Silicon Power XPOWER Storm RGB Black DDR5-7600 CL36 32GB (1x32GB),0032510b-286b-400e-8782-9f18cbd5ef1d,ram_0005,,,,,XPOWER,,,7600 CL36,
,ram,,,,,Lexar,,,,Lexar Hades OC Gray / Black DDR4-3200 CL18 16GB (1x16GB),00385f07-4afd-4adf-a183-a3d860e6a2f8,ram_0006,,,,,Hades,,,3200 CL18,
,ram,,,,,ADATA,,,,ADATA XPG LANCER RGB ROG CERTIFIED Black DDR5-7200 CL34 48GB (2x24GB),0057d8fd-0bfd-4b75-b87a-0c44b7b1c147,ram_0007,,,,,XPG,,,7200 CL34,
,ram,,,,,TEAMGROUP,,,,TEAMGROUP T-Force Delta RGB Black DDR4-3200 CL16 32GB (2x16GB),0058e77c-1417-4afd-b864-54fd0f90cdab,ram_0008,,,,,T-Force,,,3200 CL16,
,ram,,,,,TEAMGROUP,,,,TEAMGROUP T-Create Expert Gray DDR4-3200 CL16 16GB (2x8GB),007f6ea0-d1db-4c2d-824f-a44c766f8bfe,ram_0009,,,,,T-Create,,,3200 CL16,
,ram,,,,,Crucial,,,,Crucial Ballistix Sport Gray / Silver DDR4-2400 CL16 8GB (1x8GB),00882fc3-05bc-4a87-8f39-6759d883e994,ram_0010,,,,,Ballistix,,,2400 CL16,
,ram,,,,,ADATA,,,,ADATA XPG LANCER RGB Black 32GB (2x16GB) DDR5 5200 CL38,00a55598-4e9c-4255-bcda-1e97600884d6,ram_0011,,,,,XPG Lancer,,,5200 CL38,
,ram,,,,,G.SKILL,,,,G.Skill Ripjaws S5 Black DDR5-6000 CL40 48GB (2x24GB),00bafd16-7075-4205-a069-18a679ae809d,ram_0012,,,,,Ripjaws,,,6000 CL40,
,ram,,,,,TEAMGROUP,,,,TEAMGROUP T-Create Expert Black DDR5-7200 CL34 32GB (2x16GB),0118d8a1-e37c-486e-bd48-30aae342e8f8,ram_0013,,,,,T-Create,,,7200 CL34,
,ram,,,,,G.SKILL,,,,G.Skill Trident Z White / Black DDR5-5600 CL30 64GB (2x32GB),012111af-404e-42d6-aace-f3931da2eae1,ram_0014,,,,,Trident,,,5600 CL30,
,ram,,,,,G.SKILL,,,,G.Skill Trident Z5 RGB Black DDR5-6000 CL36 32GB (2x16GB),01392bfb-931b-4145-9826-77540d9f7cea,ram_0015,,,,,Trident,,,6000 CL36,
,ram,,,,,GeIL,,,,GeIL EVO V RGB Black DDR5-6800 CL36 96GB (2x48GB),0143caa5-8110-44a3-adf8-b6d4b1398722,ram_0016,,,,,EVO,,,6800 CL36,
,ram,,,,,Timetec,,,,Timetec PINNACLE Konduit RGB DDR4-3600 CL18 16GB (1x16GB),014cce3c-fd9f-4dbc-b7e3-8bbd324de68a,ram_0017,,,,,PINNACLE,,,3600 CL18,
,ram,,,,,TEAMGROUP,,,,TEAMGROUP Elite Plus Silver DDR5-5600 CL40 16GB (1x16GB),0164f75b-1318-46a3-b0f0-25b76d2ce74f,ram_0018,,,,,Elite,,,5600 CL40,
,ram,,,,,Corsair,,,,Corsair Dominator Platinum RGB Gray / Black DDR5-6000 CL30 32GB (2x16GB),016ab36c-c699-4cf1-b6bf-b8fe01c75e0f,ram_0019,,,,,Dominator,,,6000 CL30,
,ram,,,,,Corsair,,,,Corsair Vengeance RGB Black / Gray DDR5-6600 CL32 64GB (4x16GB),0180965b-df72-41b5-a7db-0b0415f385ec,ram_0020,,,,,Vengeance,,,6600 CL32,
,ram,,,,,Klevv,,,,Klevv CRAS X RGB Black DDR4-3200 CL16 8GB (1x8GB),018534ca-c5ed-413c-bed1-efb4b96404e2,ram_0021,,,,,CRAS,,,3200 CL16,
,ram,,,,,Kingston,,,,Kingston FURY Renegade Pro Registered Black DDR5-6400 CL32 128GB (4x32GB),0189f67f-5462-4b80-8886-4b9f6c5020a0,ram_0022,,,,,FURY,,,6400 CL32,
,ram,,,,,Kingston,,,,Kingston FURY White DDR5-5600 CL40 64GB (2x32GB),018e64d2-c744-4656-a22e-7da862794efb,ram_0023,,,,,FURY,,,5600 CL40,
,ram,,,,,Kingston,,,,Kingston FURY Beast Black DDR5-6000 CL30 32GB (1x32GB),019b5612-e889-4724-8acc-5332fc18e2de,ram_0024,,,,,FURY,,,6000 CL30,
,ram,,,,,Corsair,,,,Corsair Vengeance Black / Silver DDR5-6200 CL32 32GB (2x16GB),01aa1aa3-c1c7-4d4f-9872-ce0c94739ca8,ram_0025,,,,,Vengeance,,,6200 CL32,
,ram,,,,,Corsair,,,,Corsair Dominator Platinum RGB Black DDR4-3600 CL18 16GB (2x8GB),01d28304-01a0-4d29-85c4-f9f5f8daed14,ram_0026,,,,,Dominator,,,3600 CL18,
,ram,,,,,Crucial,,,,Crucial CT2K16G52C42U5 Black DDR5-5200 CL42 32GB (2x16GB),01e4e42f-2a39-47c6-b322-b5f5bb19bd90,ram_0027,,,,,CT2K16G52C42U5,,,5200 CL42,
,ram,,,,,G.SKILL,,,,G.Skill Trident Z5 Silver / Black DDR5-5600 CL36 32GB (2x16GB),01f0cbe4-4b57-49cc-a0f7-29dc75df4688,ram_0028,,,,,Trident,,,5600 CL36,
,ram,,,,,Kingston,,,,Kingston HyperX Fury Black DDR4-2666 CL16 8GB (1x8GB),020449f4-8e25-4c35-8460-fa8ed3739fa0,ram_0029,,,,,HyperX,,,2666 CL16,
,ram,,,,,Crucial,,,,Crucial CT24G56C46S5 Black SODIMM DDR5-5600 CL46 24GB (1x24GB),02090549-8582-4c57-ad57-126997365bbe,ram_0030,,,,,CT24G56C46S5,,,5600 CL46,
,ram,,,,,ADATA,,,,ADATA AD3U1600W8G11-R Black / Green DDR3-1600 CL11 8GB (1x8GB),02201f54-8c7c-4bf3-bfb9-afdc61479917,ram_0031,,,,,AD3U1600W8G11-R,,,1600 CL11,
,ram,,,,,VisionTek,,,,VisionTek 901513 DDR5-4800 CL40 32GB (1x32GB),023586f8-923f-4e22-9428-efddd38b9cbc,ram_0032,,,,,901513,,,4800 CL40,
,ram,,,,,Corsair,,,,Corsair Vengeance LPX Black DDR4-4000 CL18 64GB (2x32GB),02470f94-e037-4af6-8af7-f2d4ef71895f,ram_0033,,,,,Vengeance,,,4000 CL18,
,ram,,,,,TEAMGROUP,,,,TEAMGROUP T-Force Delta RGB Black DDR5-6000 CL38 16GB (1x16GB),02529e71-bb52-4055-8449-f252a23d76d2,ram_0034,,,,,T-Force,,,6000 CL38,
,ram,,,,,G.SKILL,,,,G.Skill Trident Z Royal Silver DDR4-3200 CL14 256GB (8x32GB),0252c1f5-ba4c-4c51-acf4-f0879a1491ba,ram_0035,,,,,Trident,,,3200 CL14,
,ram,,,,,TEAMGROUP,,,,TEAMGROUP T-Force Delta RGB Black DDR5-7200 CL34 48GB (2x24GB),025925b8-24c6-4bab-93a6-b5581a0e3129,ram_0036,,,,,T-Force,,,7200 CL34,
,ram,,,,,Kingston,,,,Kingston HyperX Fury Black DDR4-2666 CL16 16GB (2x8GB),025a42be-bf0f-4181-93ce-5d0527241bfb,ram_0037,,,,,HyperX,,,2666 CL16,
,ram,,,,,GOODRAM,,,,GOODRAM IRDM Black DDR5-6400 CL32 32GB (2x16GB),025e5bad-974c-460e-900d-6baa584e685e,ram_0038,,,,,IRDM,,,6400 CL32,
,ram,,,,,Kingston,,,,Kingston FURY Renegade Pro Registered Black DDR5-4800 CL36 32GB (1x32GB),026501cc-6e0d-4b67-be7d-b3942d000f77,ram_0039,,,,,FURY,,,4800 CL36,
,ram,,,,,Corsair,,,,Corsair Vengeance LPX Black / Yellow DDR4-4000 CL19 32GB (4x8GB),026dfda6-7109-43b2-9fc1-c1e56392a353,ram_0040,,,,,Vengeance,,,4000 CL19,
,ram,,,,,G.SKILL,,,,G.Skill Ripjaws S5 White DDR5-5200 CL40 96GB (2x48GB),02751c26-1d8d-4964-a9d2-2639a55cc43f,ram_0041,,,,,Ripjaws,,,5200 CL40,
,ram,,,,,Patriot,,,,Patriot Viper Xtreme 5 RGB Black DDR5-7600 CL36 32GB (2x16GB),029256ee-3f67-4927-896d-cf8e9286ddfa,ram_0042,,,,,Viper,,,7600 CL36,
,ram,,,,,G.SKILL,,,,G.Skill Trident Z Black DDR5-6400 CL32 32GB (2x16GB),02a5be57-3fa1-4c35-81e9-4093cc0303dd,ram_0043,,,,,Trident,,,6400 CL32,
,ram,,,,,G.SKILL,,,,G.Skill Ripjaws V Black DDR4-3600 CL14 32GB (2x16GB),02af6bd9-efaa-465d-98a9-7808ba97992a,ram_0044,,,,,Ripjaws,,,3600 CL14,
,ram,,,,,G.SKILL,,,,G.Skill Value Black DDR4-2666 CL19 8GB (1x8GB),02b79f9c-1abd-4cb4-a19b-82134c3acb7a,ram_0045,,,,,Value,,,2666 CL19,
,ram,,,,,Silicon Power,,,,Silicon Power XPOWER Zenith RGB Gaming White DDR5-6400 CL40 32GB (2x16GB),02cb863f-1b7a-42d5-afdb-c933ab6ffbb9,ram_0046,,,,,XPOWER,,,6400 CL40,
,ram,,,,,G.SKILL,,,,G.Skill Flare X Black DDR4-2400 CL15 16GB (2x8GB),02da7b10-7364-423c-83e4-0150adae1025,ram_0047,,,,,Flare,,,2400 CL15,
,ram,,,,,Kingston,,,,Kingston FURY Beast RGB Black DDR5-5600 CL36 128GB (2x64GB),02ecf08c-8492-4d08-9e3a-eb5bca237878,ram_0048,,,,,FURY,,,5600 CL36,
,ram,,,,,Corsair,,,,Corsair Dominator Platinum RGB White DDR5-5200 CL38 32GB (2x16GB),02f53f49-9f32-4db7-b13d-ab31c73de3d8,ram_0049,,,,,Dominator,,,5200 CL38,
,ram,,,,,Silicon Power,,,,Silicon Power XPOWER Storm RGB White DDR5-8000 CL38 32GB (1x32GB),03003ce7-3443-4a00-a911-9a9685574e9a,ram_0050,,,,,XPOWER,,,8000 CL38,
,ram,,,,,GeIL,,,,GeIL ORION V Red DDR5-5200 CL42 16GB (1x16GB),0302c41c-34a2-4758-a247-d920a9a0913a,ram_0051,,,,,ORION,,,5200 CL42,
,ram,,,,,Kingston,,,,Kingston FURY Renegade White / Silver DDR5-6000 CL32 64GB (2x32GB),0305fe42-e330-4bd2-bb11-a0e779257be2,ram_0052,,,,,FURY,,,6000 CL32,
,ram,,,,,Crucial,,,,Crucial Ballistix Black DDR4-3600 CL16 32GB (2x16GB),032573d7-b548-47e4-bcbc-2ebcf4131f21,ram_0053,,,,,Ballistix,,,3600 CL16,
,ram,,,,,Kingston,,,,Kingston FURY Renegade Black DDR4-3200 CL16 16GB (2x8GB),03278174-479d-45ee-a6c2-61b6dd9bb6db,ram_0054,,,,,FURY,,,3200 CL16,
,ram,,,,,TEAMGROUP,,,,TEAMGROUP Xtreem Black DDR5-6000 CL30 32GB (2x16GB),0342beff-f989-4966-b292-2e0a1b44bee1,ram_0055,,,,,Xtreem,,,6000 CL30,
,ram,,,,,Patriot,,,,Patriot Viper Venom RGB Black / White DDR5-6000 CL30 32GB (1x32GB),0349e7c8-02a7-483f-85da-42ad618c6fea,ram_0056,,,,,Viper,,,6000 CL30,
,ram,,,,,G.SKILL,,,,G.Skill Trident Z5 RGB White / Black DDR5-6400 CL32 96GB (2x48GB),03509d90-819e-400a-b835-3e0ea7518b1c,ram_0057,,,,,Trident,,,6400 CL32,
,ram,,,,,IBM,,,,IBM 00D4968 Registered Black / Green DDR3-1600 CL11 16GB (1x16GB),0354e09d-be9c-4b6c-9a7d-edd87744e473,ram_0058,,,,,00D4968,,,1600 CL11,
,ram,,,,,Corsair,,,,Corsair Dominator Platinum RGB Black DDR5-6800 CL40 64GB (2x32GB),03586a27-c995-4b9d-80d7-2c89224f857c,ram_0059,,,,,Dominator,,,6800 CL40,
,ram,,,,,G.SKILL,,,,G.Skill Trident Z White / Black DDR5-6000 CL36 32GB (2x16GB),035977c6-69c6-4c70-8fa7-3c4caa7056e0,ram_0060,,,,,Trident,,,6000 CL36,
,ram,,,,,Mushkin,,,,Mushkin Redline Lumina White DDR4-3600 CL16 32GB (2x16GB),036150d0-853f-4be1-9e2f-57ed32bb1095,ram_0061,,,,,Redline,,,3600 CL16,
,ram,,,,,G.SKILL,,,,G.Skill Trident Z5 RGB Royal Neo Gold DDR5-6000 CL28 32GB (2x16GB),03646be8-e7da-4f78-901f-ad6e8a04b9c5,ram_0062,,,,,Trident,,,6000 CL28,
,ram,,,,,TEAMGROUP,,,,TEAMGROUP T-Force Delta RGB White DDR5-6400 CL32 32GB (2x16GB),038ee200-55c1-4b8a-9f43-61f53cb66dcf,ram_0063,,,,,T-Force,,,6400 CL32,
,ram,,,,,Kingston,,,,Kingston FURY Beast RGB DDR5-6400 CL32 64GB (2x32GB),03a6ca15-5948-48e1-a8d4-4a8bdbddc83e,ram_0064,,,,,FURY,,,6400 CL32,
,ram,,,,,G.SKILL,,,,G.Skill Ripjaws M5 RGB DDR5-6000 CL36 32GB (2x16GB),03a9e11d-9e7b-4d60-9587-0b911002373e,ram_0065,,,,,Ripjaws,,,6000 CL36,
,ram,,,,,PNY,,,,PNY XLR8 Gaming EPIC-X RGB Black DDR4-3200 CL16 8GB (1x8GB),03c57400-13d3-4305-a3f2-8bf88aba729b,ram_0066,,,,,XLR8,,,3200 CL16,
,ram,,,,,G.SKILL,,,,G.Skill RipJaws S5 Series (Intel XMP) 32GB (2 x 16GB) 288-Pin SDRAM DDR5 5600 CL30-36-36-89 1.25V Dual Channel Desktop Memory F5-5600J3036D16GA2-RS5K,03c5a567-2a8f-4752-9ca3-61a43086eb11,ram_0067,,,2022,,Ripjaws S5,,,DDR5-5600 30-36-36-89 1.25V,
,ram,,,,,Corsair,,,,Corsair Vengeance LPX Black / Yellow DDR4-4000 CL19 128GB (8x16GB),03c6c762-d146-41b5-aee2-5e6b0f872fb9,ram_0068,,,,,Vengeance,,,4000 CL19,
,ram,,,,,Corsair,,,,Corsair Dominator Platinum RGB Black DDR5-5600 CL40 64GB (2x32GB),03cc52cf-0731-485e-8798-fa50a508276f,ram_0069,,,,,Dominator,,,5600 CL40,
,ram,,,,,Corsair,,,,Corsair Vengeance RGB Black DDR5-5200 CL40 32GB (2x16GB),03cf4a79-c898-47aa-981a-8e0676c17571,ram_0070,,,,,Vengeance,,,5200 CL40,
,ram,,,,,Klevv,,,,Klevv CRAS X RGB Black DDR4-3200 CL16 32GB (2x16GB),03d48746-fa01-406c-aac2-430732c7fb88,ram_0071,,,,,CRAS,,,3200 CL16,
,ram,,,,,Patriot,,,,Patriot Viper Steel Silver / Black DDR4-3600 CL17 16GB (2x8GB),03dba6f4-0c0d-47a7-95f2-92e35defceb2,ram_0072,,,,,Viper,,,3600 CL17,
,ram,,,,,Crucial,,,,Crucial CT8G4DFS8213 Black / Green DDR4-2133 CL15 8GB (1x8GB),03f6fc9b-6d9e-4f28-80c6-90fe9f381d4a,ram_0073,,,,,CT8G4DFS8213,,,2133 CL15,
,ram,,,,,G.SKILL,,,,G.Skill Ripjaws Red DDR4-2133 CL15 32GB (4x8GB),04020748-08e9-414a-b02c-3667aee89fc8,ram_0074,,,,,Ripjaws,,,2133 CL15,
,ram,,,,,Silicon Power,,,,Silicon Power XPOWER Zenith Gaming Black DDR5-6000 CL30 16GB (1x16GB),04025125-7e89-4cea-add6-268f9b3a34e0,ram_0075,,,,,XPOWER Zenith,,,6000 CL30,
,ram,,,,,Patriot,,,,Patriot Viper Elite 5 RGB DDR5-6000 CL42 32GB (1x32GB),04177551-f58f-49ff-8056-dd209c49a79c,ram_0076,,,,,Viper,,,6000 CL42,
,ram,,,,,Corsair,,,,CORSAIR Dominator Titanium RGB 64GB (2 x 32GB) DDR5 6600 (PC5 52800) Desktop Memory Model CMP64GX5M2X6600C32W,0437de06-9f62-4fbc-a69b-784ddf4f5519,ram_0077,,,2023,,Dominator Titanium,,,64GB (2x32GB) DDR5 6600 (PC5 52800) CL32,
,ram,,,,,Kingston,,,,Kingston FURY Beast Black DDR5-6000 CL30 8GB (1x8GB),043fe52c-f118-417a-9f5d-9b378deb2ad8,ram_0078,,,,,FURY,,,6000 CL30,
,ram,,,,,Patriot,,,,Patriot Signature Premium Black DDR4-2666 CL19 16GB (2x8GB),04436588-723b-4a4d-ae2f-c751160cb14b,ram_0079,,,,,Signature,,,2666 CL19,
,ram,,,,,Kingston,,,,Kingston FURY Beast RGB Black DDR5-6000 CL30 32GB (2x16GB),044f0d87-2fbc-49c4-ba90-b34c8bb1b9c7,ram_0080,,,,,FURY,,,6000 CL30,
,ram,,,,,Mushkin,,,,Mushkin Redline Lumina Black DDR4-4133 CL19 32GB (2x16GB),04561272-3266-4c3e-ac61-e370dfa4ff2c,ram_0081,,,,,Redline,,,4133 CL19,
,ram,,,,,G.SKILL,,,,G.Skill Trident Z Red / Silver DDR4-3200 CL16 32GB (2x16GB),04582edf-763f-4fcd-8b80-db988f0b1e9c,ram_0082,,,,,Trident,,,3200 CL16,
,ram,,,,,Corsair,,,,Corsair Vengeance RGB Pro SL White DDR4-3200 CL16 64GB (4x16GB),045cd56e-0003-4d45-8c59-4e460953b7c4,ram_0083,,,,,Vengeance,,,3200 CL16,
,ram,,,,,Patriot,,,,Patriot Viper Steel RGB Black DDR4-3600 CL20 8GB (1x8GB),045d68a6-e791-4cab-b29f-4e8956c41758,ram_0084,,,,,Viper,,,3600 CL20,
,ram,,,,,ADATA,,,,ADATA XPG Lancer Blade Black DDR5-6000 CL30 64GB (2x32GB),046e27c4-d83c-42be-a45c-438787267a17,ram_0085,,,,,XPG,,,6000 CL30,
,ram,,,,,Crucial,,,,Crucial CT32G56C46U5 Black DDR5-5600 CL46 32GB (1x32GB),047f942f-5062-4ec5-bc3c-769783beeaaf,ram_0086,,,,,CT32G56C46U5,,,5600 CL46,
,ram,,,,,Corsair,,,,Corsair Vengeance RGB Black DDR5-6200 CL36 32GB (2x16GB),04832da7-3c14-4f32-a0de-65e9214bf740,ram_0087,,,,,Vengeance,,,6200 CL36,
,ram,,,,,Mushkin,,,,Mushkin Redline Lumina Black DDR5-6800 CL32 32GB (2x16GB),0484f5eb-e8e7-404d-beb3-f9e517ea0c48,ram_0088,,,,,Redline,,,6800 CL32,
,ram,,,,,Silicon Power,,,,Silicon Power DDR5 32GB (2x16GB) Zenith RGB 6000MHz CL40 WHITE,049ecca5-82ba-47be-aba5-b459f705dd6b,ram_0089,,,,,XPOWER Zenith RGB,,,6000 CL40,
,ram,,,,,GeIL,,,,GeIL EVO X II AMD Black DDR4-3200 CL16 16GB (2x8GB),04a360da-8ab1-4ed8-9b76-305a628b629c,ram_0090,,,,,EVO,,,3200 CL16,
,ram,,,,,Corsair,,,,Corsair Vengeance RGB Black DDR5-6400 CL36 48GB (2x24GB),04aa7d46-60c3-42da-a309-c88506784c31,ram_0091,,,,,Vengeance,,,6400 CL36,
,ram,,,,,Kingston,,,,Kingston FURY Beast Black / Silver DDR5-6000 CL40 32GB (1x32GB),04ba0494-2071-4942-beb4-daa0585e9bfd,ram_0092,,,,,FURY,,,6000 CL40,
,ram,,,,,TEAMGROUP,,,,TEAMGROUP Elite Plus Red / Black DDR4-2400 CL16 16GB (2x8GB),04d5a5ff-6648-4733-9167-4ec199998233,ram_0093,,,,,Elite,,,2400 CL16,
,ram,,,,,Crucial,,,,Crucial Pro Black / Green DDR4-3200 CL22 64GB (2x32GB),04e9c809-5fd4-4994-ad10-c7ff5431a541,ram_0094,,,,,Pro,,,3200 CL22,
,ram,,,,,G.SKILL,,,,G.Skill NT Black DDR4-2133 CL15 16GB (2x8GB),04ef2ec6-4557-4952-8938-f207caafeaee,ram_0095,,,,,NT,,,2133 CL15,
,ram,,,,,Corsair,,,,Corsair Vengeance LPX DDR4-2666 CL15 8GB (2x4GB),04ef6691-ecbf-481c-afc1-4a703267aa18,ram_0096,,,,,Vengeance,,,2666 CL15,
,ram,,,,,Kingston,,,,Kingston FURY Beast RGB White 128GB (4x32GB) 5600MT/s CL40 DDR5 XMP DIMM | Overclocking | Plug N Play | Intel XMP 3.0 | Kit of 4 | KF556C40BWAK4-128,04efb150-0357-47f3-b8f8-9e618326600b,ram_0097,,,0,,FURY Beast,,,DDR5-5600 CL40,
,ram,,,,,TEAMGROUP,,,,TEAMGROUP Elite Black DDR5-6400 CL52 16GB (1x16GB),0521b83a-b9ae-44aa-a328-1ab0f1f0a073,ram_0098,,,,,Elite,,,6400 CL52,
,ram,,,,,Klevv,,,,Klevv FIT V White DDR5-6000 CL32 16GB (1x16GB),052830c0-c347-4731-8ffd-a9eff6cfbd7c,ram_0099,,,,,KD5AGU880-60A320Q,,,6000 CL32,
,ram,,,,,Kingston,,,,Kingston FURY Beast RGB Black DDR5-6000 CL40 16GB (2x8GB),0531d0c1-7063-48bb-8c01-836ae0c69c17,ram_0100,,,,,FURY,,,6000 CL40,
,ram,,,,,TEAMGROUP,,,,TEAMGROUP T-Force Vulcan Black DDR5-5600 CL32 16GB (1x16GB),053a86e2-a75a-4bff-abda-6a6db090dfdc,ram_0101,,,,,T-Force,,,5600 CL32,
,ram,,,,,Corsair,,,,Corsair Vengeance LPX White DDR4-3000 CL15 16GB (2x8GB),05425f1c-e720-40cc-9e7d-717756d1ad54,ram_0102,,,,,Vengeance,,,3000 CL15,
,ram,,,,,Corsair,,,,Corsair Vengeance LPX Black DDR4-3600 CL18 64GB (2x32GB),05500036-9e50-46d2-927e-893d2ff7655e,ram_0103,,,,,Vengeance,,,3600 CL18,
,ram,,,,,Silicon Power,,,,Silicon Power XPOWER Storm RGB DDR5-8000 CL38 64GB (2x32GB),056240db-b3ce-4c28-a437-bd25ebdf4f80,ram_0104,,,,,XPOWER,,,8000 CL38,
,ram,,,,,Corsair,,,,Corsair Vengeance RGB Pro Black DDR4-3600 CL18 32GB (4x8GB),056ca05d-38d7-45d0-8716-0b09430695db,ram_0105,,,,,Vengeance,,,3600 CL18,
,ram,,,,,G.SKILL,,,,G.Skill Trident Z5 Neo RGB Black DDR5-5600 CL28 32GB (2x16GB),05745aac-0f2e-46a8-87ba-e10c90691019,ram_0106,,,,,Trident,,,5600 CL28,
,ram,,,,,G.SKILL,,,,G.Skill Ripjaws S5 Black DDR5-6000 CL30 64GB (2x32GB),0578b7ea-a67f-4a33-927c-117994f3ad5f,ram_0107,,,,,Ripjaws,,,6000 CL30,
,ram,,,,,GIGABYTE,,,,Gigabyte AORUS RGB DDR4-3200 CL16 16GB (2x8GB),0587f4c6-9832-4824-964c-bfb3eec1c40a,ram_0108,,,,,AORUS,,,3200 CL16,
,ram,,,,,Kingston,,,,Kingston HyperX Predator Black / Silver DDR4-3200 CL16 16GB (2x8GB),058ddcee-b272-4eb3-a6f0-4bbe0a447f47,ram_0109,,,,,HyperX,,,3200 CL16,
,ram,,,,,Thermaltake,,,,Thermaltake TOUGHRAM XG RGB Black / Silver DDR4-4400 CL19 16GB (2x8GB),05934359-fa05-4878-9ab5-c4006557b0f9,ram_0110,,,,,TOUGHRAM,,,4400 CL19,
,ram,,,,,OLOy,,,,OLOy Blade RGB Black DDR5-5600 CL40 16GB (2x8GB),05af50df-2093-4dfa-8f79-4e5f4a29de58,ram_0111,,,,,Blade,,,5600 CL40,
,ram,,,,,Apacer,,,,Apacer Panther Silver / Black DDR5-6400 CL32 32GB (2x16GB),05cd4abf-edeb-4ac5-8b5f-e9751ff8c269,ram_0112,,,,,Panther,,,6400 CL32,
,ram,,,,,Corsair,,,,Corsair Vengeance LPX Black / Yellow DDR4-4600 CL18 32GB (4x8GB),05d4efd4-5ea6-4b77-a8e4-6688ea66df8a,ram_0113,,,,,Vengeance,,,4600 CL18,
,ram,,,,,TEAMGROUP,,,,TEAMGROUP T-Force DELTAα RGB Black DDR5-6400 CL40 16GB (2x8GB),05dbfd5b-2236-4fa4-8cef-4622db09d08a,ram_0114,,,,,T-Force,,,6400 CL40,
,ram,,,,,Silicon Power,,,,Silicon Power XPOWER Zenith Gaming White DDR5-6000 CL30 16GB (1x16GB),05e3a864-16e0-45c6-95c3-f552b97d88da,ram_0115,,,,,XPOWER Zenith,,,6000 CL30,
,ram,,,,,ADATA,,,,ADATA XPG GAMMIX D10 Black DDR4-3600 CL18 16GB (2x8GB),05f24465-8610-4656-96b8-a5d2184d076f,ram_0116,,,,,XPG,,,3600 CL18,
,ram,,,,,G.SKILL,,,,G.Skill Ripjaws M5 RGB Black DDR5-6400 CL32 96GB (2x48GB),06041383-a786-470d-914d-4da34b99d022,ram_0117,,,,,Ripjaws,,,6400 CL32,
,ram,,,,,Acer,,,,Acer Predator Pallas II Black DDR5-6400 CL32 32GB (2x16GB),06044214-e5a9-4641-92ee-4ff9b0f11e53,ram_0118,,,,,Predator,,,6400 CL32,
,ram,,,,,TEAMGROUP,,,,TEAMGROUP T-Force Vulcan Eco Silver DDR5-6000 CL30 32GB (2x16GB),0610c605-2988-4c65-8f99-8443dfd37dcb,ram_0119,,,,,T-Force,,,6000 CL30,
,ram,,,,,G.SKILL,,,,G.Skill Trident Z5 RGB Black DDR5-5600 CL30 32GB (2x16GB),0630a2d4-c741-4b8e-9671-0226ebab7ff8,ram_0120,,,,,Trident,,,5600 CL30,
,ram,,,,,G.SKILL,,,,G.Skill Trident Z5 Neo RGB White / Black DDR5-6000 CL26 48GB (2x24GB),063d8c21-72e3-4efa-99f3-eb853aa21109,ram_0121,,,,,Trident,,,6000 CL26,
,ram,,,,,Avexir,,,,Avexir Core Black / Red DDR4-2400 CL16 16GB (2x8GB),0646d74a-8da3-47c0-a355-76e5ba2d4f0b,ram_0122,,,,,Core,,,2400 CL16,
,ram,,,,,Kingston,,,,Kingston Fury Renegade RGB DDR5-8000 CL38 16GB (1x16GB),06476667-c91c-48ce-a25b-e337c0242275,ram_0123,,,,,Fury,,,8000 CL38,
,ram,,,,,Corsair,,,,Corsair Dominator Platinum RGB DDR5-6400 CL32 64GB (4x16GB),064c48b9-a5fa-4d61-8a04-f611cd0ddd94,ram_0124,,,,,Dominator,,,6400 CL32,
,ram,,,,,TEAMGROUP,,,,TEAMGROUP T-Force Delta TUF Gaming Alliance RGB Black DDR5-5200 CL40 32GB (2x16GB),064f0bba-dac7-4bc5-b029-411bd881c3b1,ram_0125,,,,,T-Force,,,5200 CL40,
,ram,,,,,G.SKILL,,,,G.Skill Trident Z5 RGB Black / Silver DDR5-6800 CL34 32GB (2x16GB),0650b0b9-5113-4f9b-959f-f10386ceb315,ram_0126,,,,,Trident,,,6800 CL34,
,ram,,,,,Corsair,,,,Corsair Vengeance LED Black / Red DDR4-3200 CL16 32GB (2x16GB),066b8850-287c-4dcc-a12e-5276c4195762,ram_0127,,,,,Vengeance,,,3200 CL16,
,ram,,,,,TEAMGROUP,,,,TEAMGROUP T-Force Xtreem ARGB Black DDR4-4000 CL18 16GB (2x8GB),0684c365-c07f-4e2f-93fd-9e24df8294fa,ram_0128,,,,,T-Force,,,4000 CL18,
,ram,,,,,Kingston,,,,Kingston Fury Renegade RGB DDR5-8000 CL38 32GB (2x16GB),068dfddf-8140-468f-81c0-5d46c190acb5,ram_0129,,,,,Fury,,,8000 CL38,
,ram,,,,,Crucial,,,,Crucial CT51264BA160B Green DDR3-1600 CL11 4GB (1x4GB),06906554-a693-405c-825d-776e3ca1a3ed,ram_0130,,,,,CT51264BA160B,,,1600 CL11,
,ram,,,,,Corsair,,,,Corsair Vengeance Black DDR5-5600 CL36 32GB (2x16GB),06b29918-1847-4754-88d2-547e35368da4,ram_0131,,,,,Vengeance,,,5600 CL36,
,ram,,,,,ADATA,,,,ADATA XPG LANCER RGB White 32GB (2x16GB) DDR5 6000 CL40,06ba879c-965e-483b-be25-b2420b1561e5,ram_0132,,,,,XPG Lancer,,,6000 CL40,
,ram,,,,,PNY,,,,PNY XLR8 Gaming EPIC-X RGB Black DDR4-3200 CL16 16GB (1x16GB),06bb9f8e-a1e4-4d07-8dd0-f3dfe55dd581,ram_0133,,,,,XLR8,,,3200 CL16,
,ram,,,,,Patriot,,,,Patriot Viper 4 Blackout Black DDR4-3200 CL16 32GB (2x16GB),06bf8965-fa5d-448a-a33a-122cbbd9efa9,ram_0134,,,,,Viper,,,3200 CL16,
,ram,,,,,Silicon Power,,,,Silicon Power XPOWER Storm RGB DDR5-7600 CL36 32GB (2x16GB),06cf477e-dd67-40ff-8e1d-2666f826336a,ram_0135,,,,,XPOWER,,,7600 CL36,
,ram,,,,,G.SKILL,,,,G.Skill Trident Z5 RGB Black DDR5-8400 CL40 48GB (2x24GB),06d2b3dc-a893-482c-b0c5-d022472981ab,ram_0136,,,,,Trident,,,8400 CL40,
,ram,,,,,Patriot,,,,Patriot Viper Venom RGB Black / White DDR5-5200 CL36 32GB (1x32GB),06dd0648-3301-463f-8834-78c014aef21c,ram_0137,,,,,Viper,,,5200 CL36,
,ram,,,,,OLOy,,,,OLOy Blade White DDR5-6000 CL32 32GB (2x16GB),06ed4fe2-94e3-4424-999e-5bd1790a3078,ram_0138,,,,,Blade,,,6000 CL32,
,ram,,,,,TEAMGROUP,,,,TEAMGROUP Xtreem ARGB Black DDR5-7200 CL34 48GB (2x24GB),06ff654d-fff6-4db4-b8a2-3e84d2dc3c77,ram_0139,,,,,Xtreem,,,7200 CL34,
,ram,,,,,Silicon Power,,,,Silicon Power SP024GBLVU520P02 Black DDR5-5200 CL42 24GB (1x24GB),0709395d-e04e-4faf-9c03-233bbc3d13a9,ram_0140,,,,,SP024GBLVU520P02,,,5200 CL42,
,ram,,,,,Corsair,,,,Corsair Dominator Platinum RGB Black / Silver DDR5-5200 CL40 32GB (2x16GB),0712aa7d-7a8c-4e5c-86b7-ba8c76ab83c8,ram_0141,,,,,Dominator,,,5200 CL40,
,ram,,,,,Kingston,,,,Kingston FURY Beast RGB White DDR5-6400 CL32 32GB (2x16GB),073e474e-f717-4936-aaf6-180354ba2a40,ram_0142,,,,,FURY,,,6400 CL32,
,ram,,,,,TEAMGROUP,,,,TEAMGROUP T-Force Delta RGB Black DDR4 16GB(2x8GB) 4000MHz CL18,07408943-1d10-4f4d-8c23-adc935566f4b,ram_0143,,,,,T-Force,,,Delta RGB BLACK DDR4,
,ram,,,,,G.SKILL,,,,G.Skill Ripjaws V Black DDR4-3200 CL16 16GB (2x8GB),074726b8-0665-4d4b-abb2-e5c7f4665d9a,ram_0144,,,,,Ripjaws,,,3200 CL16,
,ram,,,,,TEAMGROUP,,,,TEAMGROUP T-Force Vulcan Z Red DDR4-3200 CL16 16GB (2x8GB),074bb2e2-01bb-4e2a-b77d-4871a292343c,ram_0145,,,,,T-Force,,,3200 CL16,
,ram,,,,,G.SKILL,,,,G.Skill Flare X5 Black DDR5-6000 CL30 48GB (2x24GB),0761f2fb-e813-4ece-926a-7fbd66e66693,ram_0146,,,,,Flare,,,6000 CL30,
,ram,,,,,ADATA,,,,ADATA XPG Lancer Blade Black DDR5-6000 CL48 32GB (2x16GB),07638b02-7885-4d00-99be-41ebd6138402,ram_0147,,,,,XPG,,,6000 CL48,
,ram,,,,,Mushkin,,,,Mushkin Redline Lumina Black DDR5-5600 CL28 32GB (2x16GB),07cea399-420f-4142-9e44-ee20f4eb8430,ram_0148,,,,,Redline,,,5600 CL28,
,ram,,,,,G.SKILL,,,,G.Skill Ripjaws Black / Red DDR3 SODIMM-1600 CL9 16GB (2x8GB),07d163f0-e199-4507-8286-0c191364f3d5,ram_0149,,,,,Ripjaws,,,1600 CL9,
,ram,,,,,Kingston,,,,Kingston FURY Beast RGB White DDR5-6400 CL32 32GB (1x32GB),07d25918-55ca-4819-bd39-02f20176788f,ram_0150,,,,,FURY,,,6400 CL32,
,ram,,,,,GeIL,,,,GeIL EVO V RGB Black DDR5-8200 CL40 48GB (2x24GB),07e0f145-5d0d-43c9-bd83-7817aafdaae3,ram_0151,,,,,EVO,,,8200 CL40,
,ram,,,,,G.SKILL,,,,G.Skill Trident Z RGB Black DDR4-3200 CL16 16GB (2x8GB),07e2aa6a-7a7e-42ea-9b23-d703b6055aa6,ram_0152,,,,,Trident,,,3200 CL16,
,ram,,,,,Mushkin,,,,Mushkin Enhanced Redline Stiletto Black DDR4-3200 CL16 64GB (2x32GB),07ea9325-1c6b-4473-b4f4-1169236c5397,ram_0153,,,,,Enhanced,,,3200 CL16,
,ram,,,,,TEAMGROUP,,,,TEAMGROUP T-Force Vulcan Z Red DDR4-3600 CL18 32GB (2x16GB),07edd745-7354-4b21-92f9-a7d82d5f6615,ram_0154,,,,,T-Force,,,3600 CL18,
,ram,,,,,OLOy,,,,OLOy Black DDR4-3200 CL16 32GB (2x16GB) ND4U1632161DJ0DA,07fa23ea-b49e-46ce-a602-0c183afa92df,ram_0155,,,2020,,DDR4,,,3200 CL16,
,ram,,,,,Kingston,,,,Kingston FURY Beast RGB DDR5-6400 CL32 32GB (1x32GB),08236539-93fa-4db9-b94a-c9557f4705ef,ram_0156,,,,,FURY,,,6400 CL32,
,ram,,,,,Crucial,,,,Crucial Ballistix 16 GB (2 x 8 GB) DDR4-3000 CL15 Memory (BL2K8G30C15U4B),082b93be-a63f-4bc1-acc4-222dc6c5f22b,ram_0157,,,2020,,Ballistix,,,DDR4-3000 CL15,
,ram,,,,,Kingston,,,,Kingston HyperX Fury Black / White DDR4-2133 CL14 8GB (1x8GB),084c091a-7808-497d-8c3a-8247a20f504d,ram_0158,,,,,HyperX,,,2133 CL14,
,ram,,,,,v-color,,,,V-Color ECC Registered DIMM 512GB (8x64GB) DDR5 5600 CL36 Black,087b988a-34c2-4496-b705-1c7e0b67eb9b,ram_0159,,,2023,,ECC Registered DIMM,,,5600 CL36,
,ram,,,,,G.SKILL,,,,G.Skill Trident Z RGB Black DDR4-2400 CL15 32GB (2x16GB),087da2fd-b48f-4308-b4cb-e7d5c4a49b74,ram_0160,,,,,Trident,,,2400 CL15,
,ram,,,,,TEAMGROUP,,,,TEAMGROUP T-Create Expert Black / Gold DDR5-5600 CL36 32GB (2x16GB),088c1d22-c820-46d2-bbcf-b0a3302c7635,ram_0161,,,,,T-Create,,,5600 CL36,
,ram,,,,,Crucial,,,,Crucial Pro 32GB (2x16GB) DDR5 6400 CL38 Black,088f55a0-787f-423a-b5c1-f971efa6735a,ram_0162,,,2024,,Pro,,,6400 CL38,
,ram,,,,,Kingston,,,,Kingston FURY Beast Black DDR5-5200 CL40 8GB (1x8GB),08a64465-db81-48e6-85c6-014997efb242,ram_0163,,,,,FURY,,,5200 CL40,
,ram,,,,,TEAMGROUP,,,,TEAMGROUP T-Force Delta RGB Eco DDR5-6400 CL32 32GB (2x16GB),08a86b81-776e-471c-84a1-8b6164f4725a,ram_0164,,,,,T-Force,,,6400 CL32,
,ram,,,,,Mushkin,,,,Mushkin Redline Pro Black / White DDR5-5600 CL46 64GB (2x32GB),08ad8155-cc88-4a83-8c72-32e97c70ad05,ram_0165,,,,,Redline,,,5600 CL46,
,ram,,,,,G.SKILL,,,,G.Skill Sniper Black / Red DDR3-2400 CL11 16GB (2x8GB),08c02c9c-0564-46a8-a416-4e594ca455a8,ram_0166,,,,,Sniper,,,2400 CL11,
,ram,,,,,G.SKILL,,,,G.Skill Trident Z5 RGB White / Black DDR5-5200 CL40 32GB (2x16GB),08c4edaa-ea1f-4e95-b6e1-a86c4efc21c4,ram_0167,,,,,Trident,,,5200 CL40,
,ram,,,,,TEAMGROUP,,,,TEAMGROUP T-Force DELTAα RGB White DDR5-6000 CL38 64GB (2x32GB),08efa591-5224-45fa-af18-cb768bef08fe,ram_0168,,,,,T-Force,,,6000 CL38,
