cas_latency,category,color,ecc,form_factor,lighting,manufacturer,manufacturer_color,modules_capacity_gb,modules_quantity,name,opendb_id,part_id,ram_type,registered,release_year,rgb,series,speed,total_capacity_gb,variant,voltage
,ram,,,,,Silicon Power,,,,Silicon Power XPOWER Pulse Gaming Black / White DDR5-7200 CL34 16GB (1x16GB),c097496f-6dfa-4de1-8e45-f9901a4318fd,ram_3378,,,,,XPOWER,,,7200 CL34,
,ram,,,,,TEAMGROUP,,,,TEAMGROUP T-Force Xtreem ARGB White DDR4-3600 CL14 32GB (2x16GB),c0aad899-4fe1-4013-a8b2-3e7b57284b3a,ram_3379,,,,,T-Force,,,3600 CL14,
,ram,,,,,TEAMGROUP,,,,TEAMGROUP T-Force Delta RGB White DDR5-7000 CL34 96GB (2x48GB),c0be3a5c-a638-4337-a14a-aa1f21c0da4f,ram_3380,,,,,T-Force,,,7000 CL34,
,ram,,,,,Kingston,,,,Kingston ValueRAM DDR2-800 CL6 4GB (2x2GB),c0d66623-a504-410b-b603-60813c40b58a,ram_3381,,,,,ValueRAM,,,800 CL6,
,ram,,,,,Corsair,,,,Corsair Vengeance LPX Black / Yellow DDR4-2666 CL16 32GB (4x8GB),c0deee60-2c54-4f9b-b757-0582cfda7b18,ram_3382,,,,,Vengeance,,,2666 CL16,
,ram,,,,,G.SKILL,,,,G.Skill Trident Z5 RGB White / Black DDR5-5600 CL28 32GB (2x16GB),c0e0990f-e59c-4ae9-93ec-807a0a4acdd2,ram_3383,,,,,Trident,,,5600 CL28,
,ram,,,,,G.SKILL,,,,G.Skill TridentZ RGB DDR4-4600 CL20 32GB (2x16GB),c0e0d28c-11fb-4d7e-9368-b13a7f8bdfd0,ram_3384,,,,,TridentZ,,,4600 CL20,
,ram,,,,,TEAMGROUP,,,,TEAMGROUP T-Force Xtreem ARGB DDR4-3600 CL18 32GB (2x16GB),c0e381e8-0644-4b84-8592-c1839ae2c8f3,ram_3385,,,,,T-Force,,,3600 CL18,
,ram,,,,,Crucial,,,,Crucial Ballistix DDR4-3600 CL16 32GB (2x16GB),c0e9e184-f829-4a04-9865-b2001c47382e,ram_3386,,,,,Ballistix,,,3600 CL16,
,ram,,,,,PNY,,,,PNY XLR8 Gaming EPIC-X RGB Black DDR4-3600 CL18 32GB (2x16GB),c0f8ec25-fbe4-4bbc-bff2-8eb1315db305,ram_3387,,,,,XLR8,,,3600 CL18,
,ram,,,,,Corsair,,,,Corsair Vengeance RGB White DDR5-6000 CL36 32GB (2x16GB),c1005019-d4fd-4572-98f5-98fce4d7601d,ram_3388,,,,,Vengeance,,,6000 CL36,
,ram,,,,,G.SKILL,,,,G.Skill Ripjaws V Black DDR4-3200 CL16 32GB (2x16GB),c10975d5-ae7e-488f-95e7-f9270a5beb68,ram_3389,,,,,Ripjaws,,,3200 CL16,
,ram,,,,,Corsair,,,,Corsair Vengeance RGB Black / Gray DDR5-5600 CL40 64GB (2x32GB),c11c2579-edea-4594-886a-e1cc6d2887b9,ram_3390,,,,,Vengeance,,,5600 CL40,
,ram,,,,,Lexar,,,,Lexar THOR OC Black / Gold DDR5-5600 CL36 32GB (2x16GB),c12bcadc-6f76-4ab0-809a-1e8b0e8ae416,ram_3391,,,,,THOR,,,5600 CL36,
,ram,,,,,ADATA,,,,ADATA XPG GAMMIX D10 Red / White DDR4-2666 CL16 8GB (1x8GB),c14e9a77-6205-4c41-a3bf-db2d28bfac73,ram_3392,,,,,XPG,,,2666 CL16,
,ram,,,,,Crucial,,,,Crucial CT2K16G4RFD4213 Registered Green DDR4-2133 CL15 32GB (2x16GB),c157286d-121a-4419-a7fc-2dc8dc6f7ea7,ram_3393,,,,,CT2K16G4RFD4213,,,2133 CL15,
,ram,,,,,ADATA,,,,ADATA XPG Lancer Blade RGB White DDR5-6000 CL30 64GB (2x32GB),c16150d7-74bf-4cdd-a421-bf22b1faaba5,ram_3394,,,,,XPG,,,6000 CL30,
,ram,,,,,G.SKILL,,,,G.Skill Trident Z5 Royal Neo RGB DDR5-6000 CL26 64GB (2x32GB),c1667f39-e3e1-424f-a845-b4546f95e2bd,ram_3395,,,,,Trident,,,6000 CL26,
,ram,,,,,Kingston,,,,Kingston FURY Renegade Silver / Black DDR5-8000 CL38 16GB (1x16GB),c18156bc-853d-48f1-aba1-4f3062168de2,ram_3396,,,,,FURY,,,8000 CL38,
,ram,,,,,Crucial,,,,Crucial CT2K32G4DFD832A Green / Black DDR4-3200 CL22 64GB (2x32GB),c181f1fd-649c-4bfd-b90b-32aee27310c5,ram_3397,,,,,CT2K32G4DFD832A,,,3200 CL22,
,ram,,,,,G.SKILL,,,,G.Skill Ripjaws M5 RGB DDR5-6000 CL28 32GB (2x16GB) White,c18548e9-b09e-463a-afab-a2ce9a564652,ram_3398,,,,,Ripjaws,,,M5 RGB,
,ram,,,,,TEAMGROUP,,,,TEAMGROUP Elite Plus Black DDR5-6400 CL52 64GB (2x32GB),c1854957-cf78-4450-8751-73581493f0ec,ram_3399,,,,,Elite,,,6400 CL52,
,ram,,,,,Kingston,,,,Kingston FURY Beast RGB DDR4-3200 CL16 64GB (2x32GB),c1960c58-531b-4c79-a70f-0b09ce9c610c,ram_3400,,,,,FURY,,,3200 CL16,
,ram,,,,,Kingston,,,,Kingston Fury Renegade RGB Silver / Black DDR5-6400 CL32 32GB (1x32GB),c1984450-0a7d-4ae7-9692-b1bd262ea4ee,ram_3401,,,,,Fury,,,6400 CL32,
,ram,,,,,TEAMGROUP,,,,TEAMGROUP Elite Plus Black / Gold DDR4-3200 CL22 16GB (2x8GB),c19a0982-6105-423e-a956-e3fef4af6e5e,ram_3402,,,,,Elite,,,3200 CL22,
,ram,,,,,G.SKILL,,,,G.Skill Ripjaws V Black DDR4-3000 CL15 16GB (2x8GB),c1c2b039-49a9-4681-b7eb-80dcfb02746d,ram_3403,,,,,Ripjaws,,,3000 CL15,
,ram,,,,,Kingston,,,,Kingston FURY Renegade Pro Registered Black DDR5-6400 CL32 256GB (8x32GB),c1e78962-ddf1-4761-b91d-96643fe16762,ram_3404,,,,,FURY,,,6400 CL32,
,ram,,,,,Kingston,,,,Kingston FURY Renegade Silver / Black DDR5-6000 CL32 32GB (1x32GB),c1ec328d-d756-4053-a2fd-6899de21b4f1,ram_3405,,,,,FURY,,,6000 CL32,
,ram,,,,,TEAMGROUP,,,,TEAMGROUP T-Force DELTAα RGB Black DDR5-5200 CL40 32GB (2x16GB),c1ecdd68-d64b-4f8c-aadf-4a5e67e5de6b,ram_3406,,,,,T-Force,,,5200 CL40,
,ram,,,,,TEAMGROUP,,,,TEAMGROUP T-Force Xtreem ARGB DDR4-3600 CL18 64GB (2x32GB),c1f5db39-a5cb-4dcc-b087-e1d24835962f,ram_3407,,,,,T-Force,,,3600 CL18,
,ram,,,,,Corsair,,,,Corsair Vengeance LPX Black / Yellow DDR4-3200 CL16 64GB (4x16GB),c1f6f208-3caa-4d97-bb0d-6248d9f95481,ram_3408,,,,,CORSAIR,,,3200 CL16,
,ram,,,,,OLOy,,,,OLOy Blade RGB Black DDR5-6400 CL32 32GB (2x16GB),c2132dd2-3089-4d14-b307-10315df7139d,ram_3409,,,,,Blade,,,6400 CL32,
,ram,,,,,Mushkin,,,,Mushkin Enhanced Redline Stiletto Black DDR4-4133 CL19 16GB (2x8GB),c225be4e-8c98-422b-a3f0-5c5ec8b35073,ram_3410,,,,,Enhanced,,,4133 CL19,
,ram,,,,,Mushkin,,,,Mushkin Redline ST Black DDR5-6400 CL30 32GB (2x16GB),c22fab08-ae6f-4308-b2dd-6d2504d2d2ee,ram_3411,,,,,Redline,,,6400 CL30,
,ram,,,,,Timetec,,,,Timetec PINNACLE Konduit RGB White DDR4-3200 CL16 16GB (2x8GB),c231f9b2-9253-4de6-9752-e088b5918067,ram_3412,,,,,PINNACLE,,,3200 CL16,
,ram,,,,,Crucial,,,,Crucial Ballistix White DDR4-3600 CL16 16GB (2x8GB),c248bd50-feaa-43eb-b6c7-44bc1863c5af,ram_3413,,,,,Ballistix,,,3600 CL16,
,ram,,,,,Silicon Power,,,,Silicon Power XPOWER Turbine DDR4-3600 CL18 16GB (2x8GB),c24c5e07-aaca-47f0-9426-72895b102df7,ram_3414,,,,,XPOWER,,,3600 CL18,
,ram,,,,,TEAMGROUP,,,,TEAMGROUP T-Force Delta RGB DDR4 16GB (1x16GB) 3600MHz CL18 WHITE,c26b48d5-7981-4d08-b074-605d679e11f3,ram_3415,,,,,T-Force,,,Delta RGB White DDR4,
,ram,,,,,Crucial,,,,8GB Crucial Ballistix Tactical Tracer 2666MHz PC4-21300 1.2V CL16 Memory Module,c2820cd5-d8d9-4d4e-9f00-6d417c4684d3,ram_3416,,,0,,Ballistix Tactical Tracer,,,,
,ram,,,,,Mushkin,,,,Mushkin Redline Lumina White DDR4-3600 CL18 64GB (2x32GB),c28383d3-8da1-40cc-90c9-c72ade8eeafe,ram_3417,,,,,Redline,,,3600 CL18,
,ram,,,,,G.SKILL,,,,G.Skill Trident Z5 RGB White / Black DDR5-5600 CL30 64GB (2x32GB),c285efe7-2b8c-435d-91c0-15ad194b293e,ram_3418,,,,,Trident,,,5600 CL30,
,ram,,,,,G.SKILL,,,,G.Skill Trident Z5 RGB Black DDR5-6800 CL34 96GB (2x48GB),c29b1d79-7860-4203-a430-fa23ad805f89,ram_3419,,,,,Trident,,,6800 CL34,
,ram,,,,,G.SKILL,,,,G.Skill Trident Z Royal Elite Gold / Black DDR4-4000 CL14 32GB (2x16GB),c2be9dbb-16d3-4322-b56a-5098b1d03cdd,ram_3420,,,,,Trident,,,4000 CL14,
,ram,,,,,Kingston,,,,Kingston FURY Renegade Silver / Black DDR5-6800 CL36 16GB (1x16GB),c2cd0523-83de-4b6d-a772-edfad90338cf,ram_3421,,,,,FURY,,,6800 CL36,
,ram,,,,,Mushkin,,,,Mushkin Redline Lumina White DDR5-6000 CL30 32GB (2x16GB),c2d60a4d-35de-47bc-a031-334efb7809c6,ram_3422,,,,,Redline,,,6000 CL30,
,ram,,,,,Corsair,,,,Corsair Vengeance RGB Black DDR5-6400 CL38 32GB (2x16GB),c2e66413-3bb8-416a-8639-de2a713468bb,ram_3423,,,,,Vengeance,,,6400 CL38,
,ram,,,,,G.SKILL,,,,G.Skill Trident Z Royal Elite Gold DDR4-4000 CL16 32GB (2x16GB),c2f154c0-8c02-4512-be86-a9d49f0f0990,ram_3424,,,,,Trident,,,4000 CL16,
,ram,,,,,TEAMGROUP,,,,TEAMGROUP Elite Black DDR5-6000 CL40 16GB (1x16GB),c30f84a8-fc4a-4d84-8217-ab837bdb3457,ram_3425,,,,,Elite,,,6000 CL40,
,ram,,,,,Kingston,,,,Kingston HyperX Fury RGB Black / Silver DDR4-3600 CL17 32GB (2x16GB),c337cffd-b45a-4fb6-85cb-99768a73bd1f,ram_3426,,,,,HyperX,,,3600 CL17,
,ram,,,,,TEAMGROUP,,,,TEAMGROUP Elite Plus Black DDR5-4800 CL40 32GB (1x32GB),c352e6f3-98c1-47e3-bc36-00bf921f9675,ram_3427,,,,,Elite,,,4800 CL40,
,ram,,,,,Corsair,,,,Corsair Dominator Black / Blue DDR3-1600 CL8 8GB (4x2GB),c354a38e-0bd5-4f0b-8d5d-6583121b2cf3,ram_3428,,,,,Dominator,,,1600 CL8,
,ram,,,,,Crucial,,,,Crucial CT4G4DFS8213 Black / Green DDR4-2133 CL15 4GB (1x4GB),c367ec42-e603-47d3-ae4b-83c61a13518b,ram_3429,,,,,CT4G4DFS8213,,,2133 CL15,
,ram,,,,,TEAMGROUP,,,,TEAMGROUP T-Force Vulcan Red DDR5-6000 CL38 32GB (2x16GB),c369b3f4-79da-4ef4-9ca6-d079382742da,ram_3430,,,,,T-Force,,,6000 CL38,
,ram,,,,,G.SKILL,,,,G.Skill Trident Z Royal Silver DDR4-4000 CL15 16GB (2x8GB),c377188f-ec1e-4628-8f4b-39571a1ba30c,ram_3431,,,,,Trident,,,4000 CL15,
,ram,,,,,Silicon Power,,,,Silicon Power DDR5 32GB (2x8GB) Zenith RGB 6000MHz CL40 WHITE,c37c6af3-5c5f-47b5-b9f8-994aac264fbc,ram_3432,,,,,XPOWER Zenith RGB,,,6000 CL40,
,ram,,,,,G.SKILL,,,,G.Skill TridentZ RGB Black DDR4-3200 CL14 128GB (8x16GB),c3881769-e2c6-49cd-b642-f3c7c33aeced,ram_3433,,,,,TridentZ,,,3200 CL14,
,ram,,,,,Kingston,,,,Kingston FURY Beast Black DDR5-5200 CL36 32GB (2x16GB),c391b88f-6ba2-493c-871b-11e8db44cf35,ram_3434,,,,,FURY,,,5200 CL36,
,ram,,,,,G.SKILL,,,,G.Skill Flare X5 Black DDR5-6000 CL32 128GB (2x64GB),c3cb68f3-b4ef-4f55-8372-41c0084f298a,ram_3435,,,,,Flare,,,6000 CL32,
,ram,,,,,v-color,,,,V-Color TRA532G72D834Q Registered White DDR5-7200 CL34 128GB (4x32GB),c3cd014b-3689-4268-a2c5-9355467f7985,ram_3436,,,,,TRA532G72D834Q,,,7200 CL34,
,ram,,,,,Kingston,,,,Kingston FURY Renegade Silver / White DDR5-6000 CL32 32GB (2x16GB),c3cf974c-d6ea-46fb-9040-0cf66e1e197e,ram_3437,,,,,FURY,,,6000 CL32,
,ram,,,,,Mushkin,,,,Mushkin Redline ST Black DDR5-6400 CL32 32GB (2x16GB),c3da6ea4-2005-4e2b-89ba-2e1686868374,ram_3438,,,,,Redline,,,6400 CL32,
,ram,,,,,Acer,,,,Acer Predator Hermes RGB Black DDR5-6400 CL32 32GB (2x16GB),c3df3e52-1785-449f-a348-aa9ffa7902a0,ram_3439,,,,,Predator,,,6400 CL32,
,ram,,,,,ADATA,,,,ADATA XPG Lancer Blade RGB Black DDR5-6400 CL32 64GB (2x32GB),c3e52240-0f81-4b0c-a075-f1f0b9700b21,ram_3440,,,,,XPG,,,6400 CL32,
,ram,,,,,Corsair,,,,Corsair Vengeance RGB RT DDR4-4600 CL18 32GB (2x16GB),c43eb814-7c13-46b0-9e40-a27fd00ba350,ram_3441,,,,,Vengeance,,,4600 CL18,
,ram,,,,,TEAMGROUP,,,,TEAMGROUP T-Force Vulcan Red DDR5-6000 CL34 64GB (2x32GB),c450b3e6-6d1e-4622-a98c-4f6cac25c0a9,ram_3442,,,,,T-Force,,,6000 CL34,
,ram,,,,,Kingston,,,,Kingston FURY Renegade Pro Registered Black DDR5-5600 CL36 128GB (4x32GB),c46c6a3e-f22c-44d2-9b9a-aa2831a82c18,ram_3443,,,,,FURY,,,5600 CL36,
,ram,,,,,Corsair,,,,Corsair Vengeance RGB DDR5-5600 CL40 32GB (2x16GB),c4887598-9648-4d4b-a4dc-a593d756d448,ram_3444,,,,,Vengeance,,,5600 CL40,
,ram,,,,,TEAMGROUP,,,,TEAMGROUP Elite Plus Silver DDR5-4800 CL40 32GB (2x16GB),c48a6aa0-4390-4176-8bb6-d01c5f404a87,ram_3445,,,,,Elite,,,4800 CL40,
,ram,,,,,G.SKILL,,,,G.Skill Flare X5 Black DDR5-6400 CL32 32GB (2x16GB),c48da340-1b44-44ce-9079-cdf97e651193,ram_3446,,,,,Flare,,,6400 CL32,
,ram,,,,,TEAMGROUP,,,,TEAMGROUP T-Force Delta RGB Black DDR5-7600 CL36 48GB (2x24GB),c4906ba0-30fc-4640-892f-6181a79cfe41,ram_3447,,,,,T-Force,,,7600 CL36,
,ram,,,,,G.SKILL,,,,G.Skill Flare X5 Black / White DDR5-5200 CL36 64GB (2x32GB),c4982e88-e386-4ebf-9d12-9252faee3d83,ram_3448,,,,,Flare,,,5200 CL36,
,ram,,,,,Crucial,,,,Crucial Ballistix Green DDR2-1066 CL5 1GB (1x1GB),c4b02cd2-862b-44d9-a65b-f42817ffbb92,ram_3449,,,,,Ballistix,,,1066 CL5,
,ram,,,,,Crucial,,,,Crucial Ballistix RGB Red DDR4-3200 CL16 16GB (2x8GB),c4b15873-102e-489c-84df-5d141d76bce4,ram_3450,,,,,Ballistix,,,3200 CL16,
,ram,,,,,Corsair,,,,Corsair Vengeance Black / Gray DDR5-5600 CL40 32GB (2x16GB),c4c166cd-8a92-4192-8f55-1f415672b071,ram_3451,,,,,Vengeance,,,5600 CL40,
,ram,,,,,Gigastone,,,,GIGASTONE Game PRO 16GB Kit (2x8GB) DDR4 3200MHz CL16 BLACK,c4cd63cd-8580-4e58-9caa-7c6b00e4b474,ram_3452,,,,,Game PRO,,,3200 CL16,
,ram,,,,,PNY,,,,PNY Anarchy Black / Red DDR3-1866 CL10 8GB (1x8GB),c4d8d98a-b2f3-42c1-8932-c5f5760c18c2,ram_3453,,,,,Anarchy,,,1866 CL10,
,ram,,,,,Corsair,,,,Corsair Vengeance Black / Red DDR3-1600 CL9 16GB (2x8GB),c4f105c2-c174-4fc5-a0c5-b1d50cd4d6a7,ram_3454,,,,,Vengeance,,,1600 CL9,
,ram,,,,,Corsair,,,,Corsair Vengeance LPX 16GB (2 x 8GB) DDR4-5000 CL18 Memory,c4f5640b-f244-4030-a37d-75660a668710,ram_3455,,,2019,,Vengeance LPX,,,DDR4-5000 CL18,
,ram,,,,,Kingston,,,,Kingston HyperX Fury RGB Black DDR4-3200 CL16 32GB (4x8GB),c500d752-2cfb-47e7-a82c-dcf823a975c7,ram_3456,,,,,HyperX,,,3200 CL16,
,ram,,,,,Silicon Power,,,,Silicon Power DDR5 16GB (2x8GB) Zenith 5200MHz CL38 WHITE,c50a771d-bdd8-4668-8903-7df78bd4aec3,ram_3457,,,,,XPOWER Zenith,,,5200 CL38,
,ram,,,,,ADATA,,,,ADATA XPG SPECTRIX D60G White DDR4-3600 CL18 16GB (2x8GB),c518c42b-f64f-439d-8552-8eec3367bf3b,ram_3458,,,,,XPG,,,3600 CL18,
,ram,,,,,G.SKILL,,,,G.Skill Trident Z Royal Elite Gold DDR4-3600 CL16 64GB (4x16GB),c52202c7-031c-4ed0-8303-8b58eba6282f,ram_3459,,,,,Trident,,,3600 CL16,
,ram,,,,,Corsair,,,,Corsair Dominator Platinum RGB Black DDR5-7600 CL36 32GB (2x16GB),c525e082-b2cd-4e42-81f3-dfa674e2eff3,ram_3460,,,,,Dominator,,,7600 CL36,
,ram,,,,,Corsair,,,,Corsair Vengeance Black DDR4 SODIMM-3200 CL22 64GB (2x32GB),c53e2fa4-0180-4f69-b4b4-d2aa1e0a4149,ram_3461,,,,,Vengeance,,,3200 CL22,
,ram,,,,,ADATA,,,,ADATA XPG Lancer Blade Black DDR5-6000 CL34 32GB (2x16GB),c54222e4-6d9a-4e22-8146-4153238449cf,ram_3462,,,,,XPG,,,6000 CL34,
,ram,,,,,Kingston,,,,Kingston FURY Beast RGB DDR5-6400 CL32 64GB (2x32GB),c569b038-fae7-46de-ac04-c6c4fd092b64,ram_3463,,,,,FURY,,,6400 CL32,
,ram,,,,,TEAMGROUP,,,,TEAMGROUP T-Force Dark Z Silver / Black DDR4-3200 CL16 16GB (2x8GB),c584f999-835b-4c69-b694-8f08b5b9f8ff,ram_3464,,,,,T-Force,,,3200 CL16,
,ram,,,,,G.SKILL,,,,G.Skill Trident Z5 RGB White / Black DDR5-6400 CL32 32GB (2x16GB),c590923b-7fef-45d8-a9ba-c1be698150cf,ram_3465,,,,,Trident,,,6400 CL32,
,ram,,,,,Corsair,,,,Corsair Vengeance RGB Pro Black DDR4-3200 CL16 32GB (2x16GB),c5a02791-565a-4f93-ad5f-071e0fb130b3,ram_3466,,,,,Vengeance,,,3200 CL16,
,ram,,,,,Silicon Power,,,,Silicon Power DDR5 32GB (2x16GB) Zenith RGB 6000MHz CL30 White,c5ad44dc-e9ad-4ce0-9fc1-396e44c5f5df,ram_3467,,,,,XPOWER Zenith RGB,,,CL30 6000,
,ram,,,,,G.SKILL,,,,G.Skill Trident Z5 RGB White / Black DDR5-6400 CL32 64GB (2x32GB),c5c446a2-0689-498c-9b99-5b31e7ce34dd,ram_3468,,,,,Trident,,,6400 CL32,
,ram,,,,,GIGABYTE,,,,Gigabyte AORUS RGB DDR4-3333 CL18 16GB (2x8GB),c5cf7567-6c45-4524-af9f-a921008506af,ram_3469,,,,,AORUS,,,3333 CL18,
,ram,,,,,G.SKILL,,,,G.Skill TridentZ RGB Black DDR4-3600 CL14 64GB (4x16GB),c5d3b38b-f86c-400b-8305-93e17e3b22f4,ram_3470,,,,,TridentZ,,,3600 CL14,
,ram,,,,,Kingston,,,,Kingston FURY Beast Black DDR4-2666 CL16 16GB (2x8GB),c61b6841-b50a-426f-aa14-113843cba592,ram_3471,,,,,FURY,,,2666 CL16,
,ram,,,,,Patriot,,,,Patriot Viper Steel Silver / Black DDR4-4400 CL19 16GB (2x8GB),c633f12f-653b-4876-85c8-026d976d6751,ram_3472,,,,,Viper,,,4400 CL19,
,ram,,,,,Corsair,,,,Corsair Vengeance LPX Black DDR4-3600 CL19 32GB (2x16GB),c6523b6e-7491-4643-8328-b2920cc8ad49,ram_3473,,,,,Vengeance,,,3600 CL19,
,ram,,,,,Corsair,,,,Corsair Vengeance LPX Black / Yellow DDR4-3200 CL16 32GB (4x8GB),c65eb8b0-9af1-48ce-a29d-20af2d5e4737,ram_3474,,,,,Vengeance,,,3200 CL16,
,ram,,,,,G.SKILL,,,,G.Skill Ripjaws V Black DDR4-3600 CL14 32GB (2x16GB),c663880b-825b-4aa8-a271-e36eba1d439e,ram_3475,,,,,Ripjaws,,,3600 CL14,
,ram,,,,,Corsair,,,,Corsair Vengeance RGB Black DDR5-5600 CL36 32GB (2x16GB),c673ac98-f04c-4703-b2e4-298e726ccfea,ram_3476,,,,,Vengeance,,,5600 CL36,
,ram,,,,,Kingston,,,,Kingston KVR16E11S8/4 Green DDR3-1600 CL11 4GB (1x4GB),c673bc09-d21f-4979-8d7d-cd2a5485a89b,ram_3477,,,,,KVR16E11S8/4,,,1600 CL11,
,ram,,,,,Kingston,,,,Kingston FURY Renegade Black DDR4-3600 CL16 32GB (2x16GB),c67d362e-e813-4c21-9269-4cfe7231d57d,ram_3478,,,,,FURY,,,3600 CL16,
,ram,,,,,TEAMGROUP,,,,TEAMGROUP Elite Black SODIMM DDR4-3200 CL22 64GB (2x32GB),c68a2ae3-cbf2-4500-b889-4dd5c238bdec,ram_3479,,,,,Elite,,,3200 CL22,
,ram,,,,,TEAMGROUP,,,,TEAMGROUP T-Force Delta RGB DDR4 32GB (1x32GB) 3000MHz CL16 WHITE,c694e620-f461-4614-a8fa-179a31f1b960,ram_3480,,,,,T-Force,,,Delta RGB White DDR4,
,ram,,,,,G.SKILL,,,,G.Skill Sniper Black / Red DDR3-1600 CL9 8GB (2x4GB),c69f2834-b0a8-48f3-9b26-12ae79788523,ram_3481,,,,,Sniper,,,1600 CL9,
,ram,,,,,G.SKILL,,,,G.Skill Trident Z Royal Silver DDR4-4000 CL18 64GB (2x32GB),c6b331d6-9678-4c6f-8887-7ad3e1412689,ram_3482,,,,,Trident,,,4000 CL18,
,ram,,,,,v-color,,,,V-Color Manta XPrism RGB Black DDR5-6000 CL36 32GB (2x16GB),c6b927a0-0659-4e04-b733-b279cad78b5f,ram_3483,,,,,Manta,,,6000 CL36,
,ram,,,,,Corsair,,,,Corsair Vengeance LPX Black / Yellow DDR4-3200 CL16 128GB (4x32GB),c6c42f59-aad2-4842-b16b-7c2790d1bbd6,ram_3484,,,,,Vengeance,,,3200 CL16,
,ram,,,,,G.SKILL,,,,G.Skill Trident Z5 RGB White / Black DDR5-6000 CL32 32GB (2x16GB),c6c60ebc-0569-4545-b473-cb7026f81b46,ram_3485,,,,,Trident,,,6000 CL32,
,ram,,,,,Samsung,,,,Samsung M391A2K43BB1-CRC Green DDR4-2400 CL17 16GB (1x16GB),c6c676d4-b694-4c1c-9ffe-0785e24ba6d7,ram_3486,,,,,M391A2K43BB1-CRC,,,2400 CL17,
,ram,,,,,Crucial,,,,Crucial CT4K16G4VFS4266 Green / Black Registered DDR4-2666 CL19 64GB (4x16GB),c6cbc6c6-7427-4b20-b7d2-ef00ae94ffa1,ram_3487,,,,,CT4K16G4VFS4266,,,2666 CL19,
,ram,,,,,Corsair,,,,Corsair Vengeance LPX Black / Yellow DDR4-2400 CL16 64GB (2x32GB),c6ccb301-0387-407a-aaa2-4dba82f33912,ram_3488,,,,,Vengeance,,,2400 CL16,
,ram,,,,,PNY,,,,PNY Optima 8 GB (2 x 4 GB) DDR3-1333 CL9,c6d623a4-dd1a-4923-82da-2da57de7772b,ram_3489,,,,,Optima,,,1333 CL9,
,ram,,,,,TEAMGROUP,,,,TEAMGROUP TED48G2400C1601 DDR4-2400 CL16 8GB (1x8GB),c6d7cb88-794b-496e-a045-8e1a91517bad,ram_3490,,,,,TED48G2400C1601,,,2400 CL16,
,ram,,,,,Silicon Power,,,, Silicon Power XPOWER Zenith RGB Gaming Black DDR5-6000 CL30 32GB (2x16GB),c6dcb4c1-d896-4421-bc97-08363e21c862,ram_3491,,,,,XPOWER Zenith RGB,,,6000 CL30,
,ram,,,,,Corsair,,,,Corsair Vengeance LPX 32GB (2x16GB) DDR4 3200 CL16 Black,c6ddc5ed-8846-4bf5-bc53-606f85216f77,ram_3492,,,2015,,Vengeance LPX,,,3200 CL16,
,ram,,,,,G.SKILL,,,,G.Skill Trident Z Neo Silver / Black DDR4-3600 CL16 64GB (4x16GB),c6fbb703-8f8f-4d4a-82b1-a57605c18051,ram_3493,,,,,Trident,,,3600 CL16,
,ram,,,,,Kingston,,,,Kingston FURY Beast RGB Black DDR5-6400 CL32 16GB (1x16GB),c7095c16-b879-43e1-9e42-f7000a19f79d,ram_3494,,,,,FURY,,,6400 CL32,
,ram,,,,,Kingston,,,,Kingston ValueRAM SODIMM DDR4-3200 CL22 32GB (1x32GB),c70a7fc5-1a82-43f9-b176-40dd238bbe78,ram_3495,,,,,ValueRAM,,,3200 CL22,
,ram,,,,,Corsair,,,,Corsair Vengeance RGB DDR5-5600 CL36 64GB (2x32GB),c70b3ab9-b626-4d3f-8084-c762820dfdfd,ram_3496,,,,,Vengeance,,,5600 CL36,
,ram,,,,,Kingston,,,,Kingston FURY Renegade Silver / Black DDR5-7600 CL38 32GB (2x16GB),c71667fe-6a96-4f1f-a576-be5e56e8bf6f,ram_3497,,,,,FURY,,,7600 CL38,
,ram,,,,,G.SKILL,,,,G.Skill Trident Z5 Royal Neo RGB Silver DDR5-6400 CL30 32GB (2x16GB),c71b2af6-0536-455d-8943-a51680bd929d,ram_3498,,,,,Trident,,,6400 CL30,
,ram,,,,,G.SKILL,,,,G.Skill Aegis Black / Red DDR4-2400 CL15 8GB (2x4GB),c72ede54-d1ff-4e69-bcfe-73bbca5cf719,ram_3499,,,,,Aegis,,,2400 CL15,
,ram,,,,,ADATA,,,,ADATA Premier Black DDR5-4800 CL40 16GB (1x16GB),c7681f06-346b-4223-9c9c-dac4c59b906f,ram_3500,,,,,Premier,,,4800 CL40,
,ram,,,,,G.SKILL,,,,G.Skill Aegis Black / Red DDR4-2400 CL15 16GB (2x8GB),c770bae4-c991-43a4-918e-bcb1a7c64668,ram_3501,,,,,Aegis,,,2400 CL15,
,ram,,,,,Corsair,,,,Corsair Vengeance RGB Pro SL White / Black DDR4-3600 CL18 32GB (2x16GB),c772547c-ae1e-45cc-b1a8-de127e78276e,ram_3502,,,,,Vengeance,,,3600 CL18,
,ram,,,,,G.SKILL,,,,G.Skill Ripjaws M5 RGB Black DDR5-5600 CL46 64GB (2x32GB),c774eca0-6f7b-4d0c-8624-278fb04a34a8,ram_3503,,,,,Ripjaws,,,5600 CL46,
,ram,,,,,Corsair,,,,Corsair Vengeance Gray DDR5-6000 CL40 64GB (2x32GB),c7787a10-954b-444c-ab32-c27c26a87b22,ram_3504,,,,,Vengeance,,,6000 CL40,
,ram,,,,,Crucial,,,,Crucial CT8G4DFS8266 Green / Black DDR4-2666 CL19 8GB (1x8GB),c779cb21-7879-42a6-ac19-57d02602c9a4,ram_3505,,,,,CT8G4DFS8266,,,2666 CL19,
,ram,,,,,Corsair,,,,Corsair Vengeance LPX Black DDR4-3200 CL16 16GB (2x8GB),c77f4ed8-2258-4710-bf32-909893cb976e,ram_3506,,,,,Vengeance,,,3200 CL16,
,ram,,,,,Corsair,,,,Corsair Dominator Platinum Black / Silver DDR3-1866 CL9 32GB (4x8GB),c7866ea7-a1f8-4018-87fb-56b9051090a1,ram_3507,,,,,Dominator,,,1866 CL9,
,ram,,,,,Kingston,,,,Kingston FURY Beast Black DDR5-6000 CL30 64GB (2x32GB),c78743ed-5640-467d-a871-69d67a2012ea,ram_3508,,,,,FURY,,,6000 CL30,
,ram,,,,,G.SKILL,,,,G.Skill Ripjaws V Black DDR4-4000 CL14 16GB (2x8GB),c78d8f9e-b876-448e-a231-4047d532f266,ram_3509,,,,,Ripjaws,,,4000 CL14,
,ram,,,,,Acer,,,,Acer Predator Hermes RGB Silver DDR5-7200 CL36 48GB (2x24GB),c7a30281-e47f-4357-a451-ca42938c3951,ram_3510,,,,,Predator,,,7200 CL36,
,ram,,,,,Corsair,,,,Corsair Vengeance RGB Black / Silver DDR5-6000 CL30 48GB (2x24GB),c7aa3e2d-ce47-4d27-91ec-79922d28f831,ram_3511,,,,,Vengeance,,,6000 CL30,
,ram,,,,,Kingston,,,,Kingston FURY Beast 16GB (1x16GB) DDR5 5200 CL40 Black,c7c35e8b-849f-447e-accf-381c7d5575a1,ram_3512,,,2021,,FURY,,,5200 CL40,
,ram,,,,,Kingston,,,,Kingston HyperX Fury Black / White DDR4-2400 CL15 16GB (2x8GB),c7f65b65-594e-4f4f-9fd2-5766f269efac,ram_3513,,,,,HyperX,,,2400 CL15,
,ram,,,,,Kingston,,,,Kingston FURY Beast RGB Black DDR5-6000 CL30 8GB (1x8GB),c7f9faed-e7a8-4cad-acd6-671656d17873,ram_3514,,,,,FURY,,,6000 CL30,
,ram,,,,,Corsair,,,,Corsair Vengeance LPX DDR4-2400 CL16 8GB (1x8GB),c7ffb372-2791-4686-bbb3-f86b9c69792b,ram_3515,,,,,Vengeance,,,2400 CL16,
,ram,,,,,Silicon Power,,,,Silicon Power XPOWER Storm RGB White DDR5-6000 CL30 64GB (2x32GB),c8033b85-3b21-4532-8e0d-fd02e821982d,ram_3516,,,,,XPOWER,,,6000 CL30,
,ram,,,,,TEAMGROUP,,,,TEAMGROUP Elite Plus Black DDR5-5200 CL42 64GB (2x32GB),c805be78-f77b-41e7-91d8-5b57a67eb9e7,ram_3517,,,,,Elite,,,5200 CL42,
,ram,,,,,Silicon Power,,,,Silicon Power DDR5 64GB (2x32GB) XPOWER Zenith 6000MHz CL30 White,c82c047d-9a1b-4f70-bab5-9795be7e2907,ram_3518,,,,,XPOWER Zenith,,,6000 CL30,
,ram,,,,,TEAMGROUP,,,,TEAMGROUP Elite Black DDR5-4800 CL40 16GB (2x8GB),c832e9c0-4923-4b8d-9e3a-685d22de6386,ram_3519,,,,,Elite,,,4800 CL40,
,ram,,,,,G.SKILL,,,,G.Skill Trident Z5 Neo RGB Black DDR5-6000 CL26 64GB (2x32GB),c86d2929-c084-46bc-9584-b33dc0981690,ram_3520,,,,,Trident,,,6000 CL26,
,ram,,,,,Klevv,,,,Klevv BOLT X Black DDR4-3200 CL16 8GB (1x8GB),c87058cd-13a9-497d-a05e-1c6d467a718d,ram_3521,,,,,BOLT,,,3200 CL16,
,ram,,,,,G.SKILL,,,,G.Skill Zeta R5 Neo Registered Black DDR5-6400 CL32 192GB (4x48GB),c89eefaf-4970-4781-a2e7-c964a6fff5e8,ram_3522,,,,,Zeta,,,6400 CL32,
,ram,,,,,Corsair,,,,Corsair Vengeance RGB Black DDR5-6000 CL30 64GB (2x32GB),c8a3f277-2af1-4bd3-9e68-05b6a289a2f4,ram_3523,,,,,Vengeance,,,6000 CL30,
,ram,,,,,Corsair,,,,Corsair CMV8GX4M1A2133C15 Black DDR4-2133 CL15 8GB (1x8GB),c8c59546-d069-4f89-a749-ab77d7dbef0f,ram_3524,,,,,CMV8GX4M1A2133C15,,,2133 CL15,
,ram,,,,,G.SKILL,,,,G.Skill Ripjaws V Black DDR4-3200 CL16 64GB (4x16GB),c8d02b73-0d3f-4918-98d0-c172e962b4f0,ram_3525,,,,,Ripjaws,,,3200 CL16,
,ram,,,,,G.SKILL,,,,G.Skill Trident Z5 Black / Silver DDR5-5600 CL36 32GB (2x16GB),c8d51c63-3b0f-4ad2-9610-3d24de84de7e,ram_3526,,,,,Trident,,,5600 CL36,
,ram,,,,,Corsair,,,,Corsair Dominator Platinum RGB Black DDR5-6000 CL36 32GB (2x16GB),c8e2a82a-72b3-4d84-945b-5dfb8e88077f,ram_3527,,,,,Dominator,,,6000 CL36,
,ram,,,,,Samsung,,,,Samsung M471B5273DH0-CK0 Green SODIMM DDR3-1600 CL11 4GB (1x4GB),c8e3961a-6e0f-4386-b4a6-56f163775dd3,ram_3528,,,,,M471B5273DH0-CK0,,,1600 CL11,
,ram,,,,,G.SKILL,,,,G.Skill Trident Z RGB DDR4-4000 CL18 32GB (2x16GB),c8e4fc44-1dbf-491e-be11-875591f09784,ram_3529,,,,,Trident,,,4000 CL18,
,ram,,,,,G.SKILL,,,,G.Skill Ripjaws V Black DDR4-3200 CL16 32GB (4x8GB),c906a220-4d5f-4b17-9fdf-5fd236d21e8d,ram_3530,,,,,Ripjaws,,,3200 CL16,
,ram,,,,,TEAMGROUP,,,,TEAMGROUP T-Create Expert White DDR5-6000 CL30 32GB (2x16GB),c91632bd-6f3a-44a1-ab91-e9cc3ca6b2dc,ram_3531,,,,,T-Create,,,6000 CL30,
,ram,,,,,TEAMGROUP,,,,TEAMGROUP T-Force Delta RGB 16GB (2x8GB) DDR4 3200 CL16 Black,c91767dc-7b96-4353-9f06-5b1aed638a11,ram_3532,,,2017,,T-Force Delta RGB,,,3200 CL16,
,ram,,,,,Silicon Power,,,,Silicon Power XPOWER Turbine RGB DDR4-3200 CL16 16GB (2x8GB),c91bd1e9-30e6-48fa-8fb0-45092821c3d8,ram_3533,,,,,XPOWER,,,3200 CL16,
,ram,,,,,G.SKILL,,,,G.Skill Trident Z Neo Black / Silver DDR4-3800 CL14 16GB (2x8GB),c94d6258-4f3b-48df-abbc-f0c07a2586e6,ram_3534,,,,,Trident,,,3800 CL14,
,ram,,,,,G.SKILL,,,,G.Skill Ripjaws V Black DDR4-3600 CL16 16GB (2x8GB),c95d4f9b-a402-49cd-9363-de304c28d82e,ram_3535,,,,,Ripjaws,,,3600 CL16,
,ram,,,,,ADATA,,,,ADATA XPG Lancer Blade RGB White DDR5-6000 CL30 32GB (2x16GB),c9711bf9-050e-49c4-9152-3e04afd3f6d4,ram_3536,,,,,XPG,,,6000 CL30,
,ram,,,,,GeIL,,,,GeIL ORION V RGB AMD Black DDR5-5600 CL38 32GB (2x16GB),c975a95c-7047-4f56-9e8e-d98f58477069,ram_3537,,,,,ORION,,,5600 CL38,
,ram,,,,,TEAMGROUP,,,,TEAMGROUP T-Force Vulcan Z Black DDR4-2666 CL18 16GB (2x8GB),c9853c30-d709-42a5-bf57-ef99fe55df1b,ram_3538,,,,,T-Force,,,2666 CL18,
,ram,,,,,Kingston,,,,Kingston FURY Beast RGB Black DDR5-4800 CL38 32GB (2x16GB),c988d8a6-a545-460d-a2f9-222b242d282e,ram_3539,,,,,FURY,,,4800 CL38,
,ram,,,,,Corsair,,,,Corsair Vengeance LPX DDR4-2800 CL15 16GB (2x8GB),c98a11b4-4732-40af-99b6-b1ac6b48ec80,ram_3540,,,,,Vengeance,,,2800 CL15,
,ram,,,,,Patriot,,,,Patriot Viper Elite 5 Ultra RGB Black DDR5-6400 CL32 96GB (2x48GB),c98e8f3a-3d19-4fa7-b3d1-9032c7fd4b1d,ram_3541,,,,,Viper,,,6400 CL32,
,ram,,,,,PNY,,,,PNY Anarchy Black / Red DDR3-1600 CL9 8GB (2x4GB),c99c7e49-ab06-4d1c-8fee-fda919d74dbc,ram_3542,,,,,Anarchy,,,1600 CL9,
,ram,,,,,PNY,,,,PNY XLR8 Gaming MAKO RGB Black DDR5-6400 CL40 32GB (2x16GB),c99f2ba0-23c1-4edf-a615-6fcd2037e8b0,ram_3543,,,,,XLR8,,,6400 CL40,
,ram,,,,,Silicon Power,,,,Silicon Power DDR5 64GB (2x32GB) Zenith RGB 5200MHz CL38 WHITE,c9a1b31d-e52e-4f15-8a35-689eddddbeeb,ram_3544,,,,,XPOWER Zenith RGB,,,5200 CL38,
,ram,,,,,Corsair,,,,VENGEANCE® RGB PRO 16GB (2 x 8GB) DDR4 DRAM 3200MHz C16 Memory Kit — Black,c9b24fb1-7687-4327-939f-8673509a6951,ram_3545,,,2024,,VENGEANCE® RGB PRO,,,3200MHz CL16,
,ram,,,,,Corsair,,,,Corsair Vengeance LPX White DDR4-2666 CL16 16GB (2x8GB),c9b30e91-d222-44b6-a88c-4133c360c32d,ram_3546,,,,,Vengeance,,,2666 CL16,
